PAGINA,DESCRIPCION,PRECIO,
1, k- BURBERRY BABY TOUCH 3.4oz SPY EDP KIDS,40.00, $20.00 
1, K- LOONEY TUNES 3.4oz SPY EDT KIDS,28.00, $8.00 
1, k- TELETUBIES RED 1.7oz SPY EDT KIDS,26.00, $6.00 
1, K-SET LOONEY TUNES (3pcs) 3.4oz SPY EDT + 3.4oz SHOWER GEL + KEY CHAIN (METALLIC LUNCH BOX) KIDS,30.00, $10.00 
1, K-SET MINIONS (3pcs) 1.7oz SPY EDT+STICKERS+MAGNETS,30.00, $10.00 
1, K-SET PRECIOUS MOMENTS 1.7oz SPY EDT WITH METAL LUNCH BOX,28.00, $8.00 
1, kB- GI JOE 3.4oz SPY EDT BOYS,28.00, $8.00 
1, kB- GI JOE COBRA 3.4oz SPY EDT BOYS,28.00, $8.00 
1, kB- KUNG-FU PANDA PO 3.4oz SPY EDT BOYS,28.00, $8.00 
1, kB- PIRATES OF THE CARIBBEAN 3.4oz SPY EDT BOYS,28.00, $8.00 
1, KB- PLANES 3.4oz SPY EDT BOYS,28.00, $8.00 
1, kB- POKEMON 3.3oz SPY EDT BOY,28.00, $8.00 
1, kB- SMURFS 3D 3.4oz SPY EDT BOYS,28.00, $8.00 
1, kB- SMURFS 1.7oz SPY EDT KIDS BOYS,26.00, $6.00 
1, kB- SPIDERMAN ULTIMATE 3.4oz SPY EDT BOYS,28.00, $8.00 
1, kB- SPIDERMAN ULTIMATE 3.4oz SPY EDT BOYS (METAL BOX),28.00, $8.00 
1, KB- SPONGE BOB 3.4 SPY EDT M,28.00, $8.00 
1, kB- SUPERMAN 1.7oz SPY EDT BOYS,25.00, $5.00 
1, KB-SET ANGRY BIRDS GO! (3pcs) 1.7oz SPY EDT+STICKERS+TIN BOX,30.00, $10.00 
1, KB-SET ANGRY BIRDS KING PIG (2pcs) 3.4oz SPY EDT + PIGGY BANK (GREEN),30.00, $10.00 
1, KB-SET ANGRY BIRDS RED (2pcs) 3.4oz SPY EDT + PIGGY BANK,30.00, $10.00 
1, KB-SET ANGRY BIRDS RED (3pcs) 1.7oz SPY EDT+5.1oz+SPONGE,30.00, $10.00 
1, KB-SET BATMAN (2pcs) 3.4oz SPY EDT + 8.0oz BODY WASH BOYS,30.00, $10.00 
1, KB-SET DISNEY BIG HERO 6 (2pcs) 3.4oz SPY EDT + 10.2oz SHOWER GEL,30.00, $10.00 
1, KB-SET DISNEY CARS (2pcs) 3.3oz SPY EDT + 3.3oz SHOWER GEL BOYS,28.00, $8.00 
1, KB-SET DISNEY CARS RACERS (2pcs) 3.4oz SPY EDT + METAL LUNCH BOX,30.00, $10.00 
1, KB-SET DISNEY DONAL DUCK (2pcs) 1.7oz SPY EDT + 2.55oz SHOWER GEL (METAL BOX) BOYS,28.00, $8.00 
1, KB-SET DISNEY MICKEY MOUSE (2pcs) 1.7oz SPY EDT + LUGGAGE TAG (METAL LUNCH BOX) BOYS,30.00, $10.00 
1, KB-SET DISNEY PLANES (2pcs) 1.7oz SPY EDT + PLANES STICKERS (METAL LUNCH),30.00, $10.00 
1, KB-SET DISNEY TOY STORY (2pcs) 3.3oz SPY EDT + SHOWER GEL BOYS,28.00, $8.00 
1, KB-SET FRANKLIN (2pcs) 3.4oz SPY EDT + MATCHING GLOVES BOYS,28.00, $8.00 
1, KB-SET MARVEL AVENGERS (2pcs) 3.4oz SPY EDT + METAL LUNCH BOX,30.00, $10.00 
1, KB-SET MARVEL COMICS (IRON MAN-WOLVERINE-HULK-SPIDER MAN-THOR AND CAPITAN AMERICA) (2pcs) 3.4oz SPY EDT + 3.3oz S.G. BOYS,28.00, $8.00 
1, KB-SET SPIDERMAN (2pcs) 3.4oz SPY EDT + 10.2oz SHOWER GEL,30.00, $10.00 
1, KB-SET SPIDERMAN ULTIMATE (2pcs) 3.4oz SPY + METAL LUCH BOX,30.00, $10.00 
1, kG- DISNEY MINNE MOUSE 3.4oz SPY EDT GIRLS,28.00, $8.00 
1, kG- DISNEY MY PRINCESS BELLE 3.4oz SPY EDT GIRLS,28.00, $8.00 
1, kG- DISNEY MY PRINCESS CINDERELLA 3.4oz SPY EDT GIRLS,28.00, $8.00 
1, kG- DISNEY MY PRINCESS SLEEPING BEAUTY 3.4oz SPY EDT GIRLS,28.00, $8.00 
1, kG- DISNEY MY PRINCESS SNOWWHITE 3.4oz SPY EDT GIRLS,28.00, $8.00 
1, kG- DISNEY MY PRINCESS TANGLE 3.4oz SPY EDT GIRLS (RAPUNZEL),28.00, $8.00 
1, kG- DISNEY PRINCES 3D CAP 1.7oz SPY EDT W,28.00, $8.00 
1, kG- DISNEY PRINCES SNOW WHITE 3D CAP 1.7oz SPY EDT W (JUICY APPLE),28.00, $8.00 
1, kG- DISNEY PRINCESS CINDERELLA 3.4oz SPY EDT GIRLS,28.00, $8.00 
1, kG- DISNEY PRINCESS SLEEPING BEAUTY 3.4oz SPY EDT GIRLS,28.00, $8.00 
1, kG- DISNEY PRINCESS SNOWWHITE 3.4oz SPY EDT GIRLS,28.00, $8.00 
1, kG- DISNEY PRINCESS TINKER BELL 3.4oz SPY EDT GIRLS,28.00, $8.00 
1, KG- DISNEY SOFIA THE FIRST 3.4oz SPY EDT GIRLS,28.00, $8.00 
1, kG- DISNEY TINKER BELL 1.7oz SPY EDT,28.00, $8.00 
1, KG- DISNEY TINKER BELL 1.7oz SPY EDT (FANCY METALIC BOX),30.00, $10.00 
1, kG- DISNEY TINKER BELL 3.4oz SPY EDT,28.00, $8.00 
1, kG- DORA 3.4oz SPY EDP K GIRLS (3D CAP),28.00, $8.00 
1, kG- GIORGIO VALENTI BLUE DIVA 3.4oz SPY EDT GIRLS,30.00, $10.00 
1, kG- HANNAH MONTANA SPY EDT K NEW GIRLS,28.00, $8.00 
1, kG- PRINCESS FIONA 2.5 SPY EDP W GIRLS,28.00, $8.00 
1," kG- SMURFS ""3D"" 3.4oz SPY EDT GIRLS",28.00, $8.00 
1, kG- STRAWBERRY SHORTCAKE 3.4 SPY EDT GIRLS,28.00, $8.00 
1, KG-SET ANGRY BIRDS STELA (2pcs) 1.7oz SPY EDT + METAL PURSE (PINK),30.00, $10.00 
1, KG-SET ANGRY BIRDS STELA (2pcs) 3.4oz SPY EDT + PIGGY BANK (PINK),30.00, $10.00 
1, KG-SET BARBIE (3pcs) 3.4oz SPY EDT+ LIP GLOSS + KEY CHAIN,30.00, $10.00 
1, KG-SET DISNEY CAMP ROCK (2pcs) 1.7oz SPY EDT + 2.55oz SHOWER GEL KIDS (METAL BOX),28.00, $8.00 
1, KG-SET DISNEY DAISY DUCK (2pcs) 1.7oz SPY EDT + 2.5oz SHOWER GEL METALLIC LUNCH BOX GIRLS,28.00, $8.00 
1, KG-SET DISNEY DOC McSTUFFINS 3.4oz SPY EDT+ TIN BOX,30.00, $10.00 
1, KG-SET DISNEY FROZEN (2pcs) 3.4oz SPY EDT + 10.0oz SHOWER GEL,30.00, $10.00 
1, KG-SET DISNEY FROZEN (3pcs) (2 X 1.02oz SPY EDT ) + 2.7oz BATH GEL,30.00, $10.00 
1, KG-SET DISNEY FROZEN (3pcs) 1.02oz SPY EDT + STIKER + BRACELET,30.00, $10.00 
1, KG-SET DISNEY HANNAH MONTANA (2pcs) 1.7oz SPY EDT + 2.55oz BUBBLE BATH GIRLS (METAL BOX),28.00, $8.00 
1, KG-SET DISNEY HANNAH MONTANA (3pcs) 3.4oz SPY EDT + 6.8oz BUBBLE BATH+ 6.8oz SPARKLING BODY LOTION GIRLS,33.00, $13.00 
1, KG-SET DISNEY MY PRINCESS (3pcs) 1.7oz SPY EDT + 2.4oz B.L.+TIN BAG,30.00, $10.00 
1, KG-SET DISNEY PRINCES TANGLE (2pcs) 1.7oz SPY EDT + METALLIC JEWERLY BOX GIRLS,28.00, $8.00 
1, KG-SET DISNEY PRINCESS (2pcs) 1.7oz SPY EDT + 2.55oz SHOWER GEL GIRLS (METAL BOX),28.00, $8.00 
1, KG-SET DISNEY PRINCESS (2pcs) 1.7oz SPY EDT+ METALLIC PURSE,30.00, $10.00 
1, KG-SET DISNEY PRINCESS (2pcs) 3.4oz SPY EDT+METALLIC HEART BAG,30.00, $10.00 
1, KG-SET DISNEY PRINCESS (5pcs) 1.02oz SPY EDT+ PHOTO FARME+BRACELET+STICK ON EARRINGS+ RING,30.00, $10.00 
1, KG-SET DISNEY PRINCESS BOOK (7pcs) 1.7oz SPY EDT + NOTE BOOK+ERASER+PENCILL +SHARPENER+STICKERS AND SCISSORS,30.00, $10.00 
1, KG-SET DISNEY PRINCESS FLOWERS COLLECTION (9pcs) 6 FLOWERS 2.0oz + 3 PERFUMED BAR SOAP GIRLS 1.0oz GIRLS,40.00, $20.00 
1, KG-SET DISNEY PRINCESS PURSE (3pcs) 1.7oz SPY EDT + DIAMONDS STICKERS+ METAL PURSE,30.00, $10.00 
1, KG-SET DISNEY TINKERBELL FAIRIES (2pcs)+1.7oz SPY EDT+TIN BAG,30.00, $10.00 
1, KG-SET HANNA MONTANA TIN BOX 1.7oz SPY EDP W,27.00, $7.00 
1, KG-SET HELLO KITTY 3.4oz SPY EDT + METAL LUNCH BOX GIRLS,30.00, $10.00 
1, KG-SET LOONEY TUNES TWEETY 3.3oz SPY EDT + 6.8oz PERFUMERED SHOWER GEL KIDS (NEW FRAGRANCE),30.00, $10.00 
1, KG-SET MONSTER HIGH (2pcs) 2.5oz SPY EDT+5.1oz B.L.,30.00, $10.00 
1, KG-SET MONSTER HIGH (6pcs) 1.7oz SPY EDT + NOTE BOOK+ERASER+PENCILL +SHARPENER+STICKERS,30.00, $10.00 
1, KG-SET MY LITTLE PONY (2pcs) 1.7oz SPY EDT + HAIR BRUSH GIRLS,28.00, $8.00 
1, KG-SET SPONGE BOB (2pcs) 3.4 SPY EDT + 8.0oz BODY WASH,28.00, $8.00 
1, KG-SET THE SMURFS PAPA (2pcs) 1.7oz SPY EDT + 2.55oz SHOWER GEL (METAL BOX) GIRLS,30.00, $10.00 
1, KG-SET THE SMURFS SMURFETTE (2pcs) 1.7oz SPY EDT + 2.55oz SHOWER GEL (METAL BOX) GIRLS,30.00, $10.00 
1, KG-SET TINKERBELL (3pcs) 3.4oz SPY EDT + 6.8oz SHOWER GEL + 6.8oz BODY LOTION GIRLS,33.00, $13.00 
2, W- ADRIENNE VITTADINI AV 3.0oz SPY EDP W,35.00, $15.00 
2," W- ALFRED SUNG ""SUNG"" 3.4oz SPY EDT W",40.00, $20.00 
2, W- ALFRED SUNG PURE 3.4oz SPY EDP W,40.00, $20.00 
2, W- ALFRED SUNG SHI 3.4oz SPY EDP,38.00, $18.00 
2, W- AMOR 3.3oz SPY W,28.00, $8.00 
2, W- ANIMALE 3.4oz SPY EDP W,45.00, $25.00 
2, W- ANIMALE ANIMALE 3.4oz SPY EDP W,40.00, $20.00 
2, W- ANIMALE TEMPTATION 3.4oz SPY EDT W,30.00, $10.00 
2, W- ANUCCI WAVE 2.5oz SPY EDT W,26.00, $6.00 
2, W- ARMAF EDITION ONE 3.4oz SPY EDP W,35.00, $15.00 
2, W- BABY PHAT GODDESS 3.4oz SPY EDP W,35.00, $15.00 
2, W- BALENCIAGA LESSENCE 2.5oz SPY EDP W,75.00, $55.00 
2, W- BALENCIAGA PARIS 2.5oz SPY EDP W,75.00, $55.00 
2," W- BCBG MAXAZRIA ""BON CHIC"" 3.4oz SPY EDP W",40.00, $20.00 
2, W- BCBG MAXAZRIA 3.4oz SPY EDP W,40.00, $20.00 
2, W- BCBG MAXAZRIA BON GENRE 3.4oz SPY EDP W,40.00, $20.00 
2, W- BEAUTIFUL FLOWER 3.4oz SPY EDT W,28.00, $8.00 
2, W- BEAUTIFUL FLOWER PINK DAISY 3.4oz SPY EDT W,28.00, $8.00 
2, W- BEAUTIFUL FLOWER PURPLE ORCHID 3.4oz SPY EDT W,28.00, $8.00 
2, W- BEAUTIFUL FLOWER RED GERBER 3.4oz SPY EDT W,28.00, $8.00 
2, W- BEBE 3.4oz SPY EDP W,40.00, $20.00 
2, W- BEBE DESIRE 3.4oz SPY EDP W,40.00, $20.00 
2, W- BEBE GLAM 3.4oz SPY EDP W,40.00, $20.00 
2, W- BEBE GOLD 3.4oz SPY EDP W,40.00, $20.00 
2, W- BEBE LOVE 3.4oz SPY EDP W,40.00, $20.00 
2, W- BEBE NOUVEAU 3.4oz SPY EDP W,40.00, $20.00 
2, W- BEBE NOUVEAU CHIC 3.4oz SPY EDP W,40.00, $20.00 
2, W- BEBE SHEER 3.4oz SPY EDP W,40.00, $20.00 
2, W- BEBE WISHES & DREAMS 3.3oz SPY EDP W,40.00, $20.00 
2, W- BENETTON HOT GOLD 3.4OZ SPY W,30.00, $10.00 
2, W- BENETTON ROSSO 3.4oz SPY EDT W,30.00, $10.00 
2, W- BETSY JHONSON 3.4oz SPY EDP W,45.00, $25.00 
2, W- BETSY JHONSON TOO TOO 3.4oz SPY EDP W,45.00, $25.00 
2, W- BEYONCE HEAT 3.4oz SPY EDP W,35.00, $15.00 
2, W- BEYONCE HEAT MRS CARTER 3.4oz SPY EDP W,38.00, $18.00 
2, W- BEYONCE HEAT WILD ORCHID 3.4oz SPY EDP W,35.00, $15.00 
2, W- BEYONCE MIDNIGHT HEAT 3.4oz SPY EDP W,35.00, $15.00 
2, W- BEYONCE PULSE 3.4oz SPY EDP W,38.00, $18.00 
2, W- BEYONCE PULSE NYC 3.4oz SPY EDP W,38.00, $18.00 
2, W- BEYONCE RISE 3.4oz SPY EDP W,35.00, $15.00 
2, W- BILL BLASS BASIC BLACK 3.4oz SPY EDT,38.00, $18.00 
2, W- BILL BLASS HOT 3.4oz SPY EDC W,40.00, $20.00 
2, W- BILL BLASS NUDE 3.4oz SPY EDC W,40.00, $20.00 
2, W- BODY SPRAY 8.0oz,25.00, $5.00 
2, W- BOUCHERON by BOUCHERON 3.4oz SPY EDT W,50.00, $30.00 
2, W- BOUCHERON JAIPUR BRACELET 3.4oz EDP SPY WOMEN,65.00, $45.00 
2, W- BOUCHERON PLACE VENDOME 3.3oz SPY EDP W,60.00, $40.00 
2, W- BRITNEY SPEARS BELIEVE 3.3oz SPY EDP W,40.00, $20.00 
2, W- BRITNEY SPEARS CIRCUS 3.4oz SPY EDP W,40.00, $20.00 
2, W- BRITNEY SPEARS COSMIC RADIANCE 3.4oz SPY W,38.00, $18.00 
2, W- BRITNEY SPEARS CURIOUS IN CONTROL 3.4oz SPY EDP W,40.00, $20.00 
2, W- BRITNEY SPEARS FANTASY 3.3oz SPY EDP W,45.00, $25.00 
2, W- BRITNEY SPEARS FANTASY THE NAUGHTY REMIX 3.3oz SPY EDP W,38.00, $18.00 
2, W- BRITNEY SPEARS FANTASY THE NICE REMIX 3.3oz SPY EDP W,38.00, $18.00 
2, W- BRITNEY SPEARS HIDDEN FANTASY 3.3oz SPY EDP W,38.00, $18.00 
2, W- BURBERRY 3.4 SPY EDP W,48.00, $28.00 
2, W- BURBERRY BODY INTENSE 2.8oz SPY EDP W,55.00, $35.00 
2, W- BURBERRY BODY TENDER 2.8oz SPY EDT W,50.00, $30.00 
2, W- BURBERRY BRIT 3.4oz SPY EDT W,48.00, $28.00 
2, W- BURBERRY BRIT RHYTHM 3.0oz SPY EDT W,48.00, $28.00 
2, W- BURBERRY BRIT SHEER 3.4oz SPY EDT W,50.00, $30.00 
2, W- BURBERRY LONDON FABRIC 3.4oz SPY EDP W,55.00, $35.00 
2, W- BURBERRY SPORT 2.5oz SPY EDT W,48.00, $28.00 
2, W- BURBERRY THE BEAT 2.5oz SPY EDT W,48.00, $28.00 
2, W- BURBERRY TOUCH 3.3oz SPY EDP W,48.00, $28.00 
2, W- BURBERRY WEEKEND 3.3oz SPY EDP W,50.00, $30.00 
2, W- BVLGARI AQUA DIVINA 2.2oz SPY EDT W,20.00, $-   
2, W- BVLGARI BLV II 2.5oz EDP SPY W,50.00, $30.00 
2, W- BVLGARI JASMINE NOIR 3.4oz SPY EDT W,60.00, $40.00 
2, W- BVLGARI MON JASMINE NOIR 2.5oz SPY EDP W,55.00, $35.00 
2, W- BVLGARI OMNIA AMETHYSTE 2.2oz SPY EDT W,55.00, $35.00 
2, W- BVLGARI OMNIA CORAL 2.2oz SPY EDT W,55.00, $35.00 
2, W- BVLGARI OMNIA CRYSTALINE 2.2oz SPY EDT W,55.00, $35.00 
2, W- BVLGARI OMNIA INDIAN GARNET 2.2oz SPY EDT W,58.00, $38.00 
2, W- BVLGARI POUR FEMME 3.4oz SPY EDT W,55.00, $35.00 
2, W- BVLGARI ROSE ESSENTIALLE 3.4oz SPY EDP W,58.00, $38.00 
2, W- CACHAREL AMOR AMOR 3.4oz SPY EDT W,58.00, $38.00 
2, W- CACHAREL AMOR AMOR FORBIDDEN KISS 3.4oz SPY EDT W,58.00, $38.00 
2, W- CACHAREL AMOR AMOR IN A FLASH 3.4oz SPY EDT W,55.00, $35.00 
2, W- CACHAREL AMOR AMOR LEAU 3.4oz SPY EDT W,65.00, $45.00 
2, W- CACHAREL ANAIS ANAIS 3.4oz SPY EDT W,58.00, $38.00 
2, W- CACHAREL CATCH ME 2.7oz SPY EDP W,65.00, $45.00 
2, W- CACHAREL NOA 3.3oz SPY EDT W,58.00, $38.00 
2, W- CAFE CAFE 3.4oz SPY EDT W,30.00, $10.00 
2, W- CALVIN KLEIN CK ONE RED EDITION 3.4oz SPY EDT,45.00, $25.00 
2, W- CALVIN KLEIN CKIN2U 5.0oz SPY EDT W,45.00, $25.00 
2, W- CALVIN KLEIN CONTRADICTION 3.4oz SPY EDP W,45.00, $25.00 
2, W- CALVIN KLEIN DOWNTOWN 3.0oz SPY EDP W,45.00, $25.00 
2, W- CALVIN KLEIN ESCAPE 3.4oz SPY EDP W,48.00, $28.00 
2, W- CALVIN KLEIN ETERNITY 3.4oz SPY EDP W,50.00, $30.00 
2, W- CALVIN KLEIN ETERNITY AQUA 3.4oz SPY EDP W,45.00, $25.00 
2, W- CALVIN KLEIN ETERNITY MOMENT 3.4oz SPY EDP W,45.00, $25.00 
2, W- CALVIN KLEIN ETERNITY PURPLE ORCHID 3.4oz SPY EDT W,48.00, $28.00 
2, W- CALVIN KLEIN ETERNITY SUMMER 3.4oz SPY EDP W,45.00, $25.00 
2, W- CALVIN KLEIN EUPHORIA 3.4oz SPY EDP W,58.00, $38.00 
2, W- CALVIN KLEIN EUPHORIA BLOSSON 3.4oz SPY EDT W,55.00, $35.00 
2, W- CALVIN KLEIN EUPHORIA ENDLESS 4.2oz SPY EDP W,55.00, $35.00 
2, W- CALVIN KLEIN EUPHORIA FORBIDDEN 3.3oz SPY EDP W,55.00, $35.00 
2, W- CALVIN KLEIN OBSESSION 3.4oz SPY EDP W,45.00, $25.00 
2, W- CALVIN KLEIN OBSESSION SECRET 3.4oz SPY EDP W,45.00, $25.00 
2, W- CALVIN KLEIN REVEAL 3.4 oz SPY EDP W,48.00, $28.00 
2, W- CALVIN KLEIN SHEER BEAUTY 3.4oz SPY EDT W,45.00, $25.00 
2, W- CALVIN KLEIN TRUTH 3.4oz SPY EDP W,50.00, $30.00 
2, W- CAROLINA HERRERA 212 3.4oz SPY EDT W,68.00, $48.00 
2, W- CAROLINA HERRERA 212 H2O 3.4oz SPY EDT W,75.00, $55.00 
2, W- CAROLINA HERRERA 212 SEXY 3.4oz SPY EDP W,68.00, $48.00 
2, W- CAROLINA HERRERA 212 VIP 2.7oz SPY EDP W,65.00, $45.00 
2, W- CAROLINA HERRERA 212 VIP ROSE 2.8oz SPY EDP,70.00, $50.00 
2, W- CAROLINA HERRERA 3.4oz SPY EDT W,58.00, $38.00 
2, W- CAROLINA HERRERA CHIC 2.7oz SPY EDP W,65.00, $45.00 
2, W- CARTIER DE LUNE 4.2oz SPY EDT W,58.00, $38.00 
2, W- CARTIER MUST 3.4oz SPY EDT W,60.00, $40.00 
2, W- CERRUTI 1881 FEMME 3.4oz SPY EDT W,48.00, $28.00 
2, W- CHLOE NARCISSE 3.40oz SPY EDT W,45.00, $25.00 
2, W- CHLOE ROSES DE CHLOE 2.5oz SPY EDT W,70.00, $50.00 
2, W- CHOPARD MADNESS 3.4oz SPY EDP W,35.00, $15.00 
2, W- CHOPARD WISH 2.5oz SPY EDP W,45.00, $25.00 
2, W- CHRISTIAN DIOR DIOR ADDICT 3.4 SPY EDT W,95.00, $75.00 
2, W- CHRISTIAN DIOR DOLCE VITA 3.4oz SPY EDT W,95.00, $75.00 
2, W- CHRISTIAN DIOR DUNE 3.4oz SPY EDT W,95.00, $75.00 
2, W- CHRISTIAN DIOR MISS DIOR 3.4oz SPY EDT W,85.00, $65.00 
2, W- CHRISTIAN DIOR POISON 3.4oz SPY EDT W,95.00, $75.00 
2, W- CHRISTIAN DIOR POISON HYPNOTIC 3.4oz SPY EDT W,95.00, $75.00 
2, W- CHRISTIAN DIOR POISON HYPNOTIC EAU SECRETE 3.4oz SPY EDT W,95.00, $75.00 
2, W- CHRISTINE ARBEL MISS ARBEL 3.4oz SPY EDP W,28.00, $8.00 
2, W- CHRISTINE ARBEL CELEBRITY 3.4oz SPY EDT W,28.00, $8.00 
2, W- CHRISTINE DARVIN HELLO HELLO 3.4oz SPY EDT W,26.00, $6.00 
2, W- CHRISTINE DARVIN MOD TOUCH 3.4oz SPYY EDP W,29.00, $9.00 
2, W- CLINIQUE AROMATICS ELIXIR 3.4oz SPY EDP W,68.00, $48.00 
2, W- CLINIQUE AROMATICS IN WHITE 3.4oz SPY EDP W,75.00, $55.00 
2, W- CLINIQUE HAPPY CLINIQUE 3.4oz SPY EDP W,58.00, $38.00 
2, W- CLINIQUE HAPPY HEART 3.4oz SPY EDP W,68.00, $48.00 
2, W- CLINIQUE SIMPLY 3.4oz SPY EDP W,65.00, $45.00 
2, W- COACH POPPY 3.4oz SPY EDP W,65.00, $45.00 
2, W- DAVID YURMAN DELICATE ESSENCE 3.4oz SPY EDT W,50.00, $30.00 
2, W- DAVID YURMAN EXOTIC ESSENCE 3.4oz SPY EDT W,50.00, $30.00 
2, W- DAVIDOFF COOL WATER 3.4oz SPY EDT W,45.00, $25.00 
2, W- DAVIDOFF COOL WATER CORAL REEF 3.4oz SPY EDT W,40.00, $20.00 
2, W- DAVIDOFF COOL WATER SENSUAL ESSENCE 3.4oz SPY EDT W,45.00, $25.00 
2, W- DAVIDOFF ECHO 3.4oz SPY EDP W,45.00, $25.00 
2, W- DENISE RICHARDS 3.4oz SPY EDP W,35.00, $15.00 
2, W- DEON UP SIDE DOWN 3.4oz SPY EDP W,28.00, $8.00 
2, W- DESIRADE 3.4oz SPY EDT W,30.00, $10.00 
2, W- DESIRADE MY DESIRE 3.4oz SPY EDT W,30.00, $10.00 
2, W- DIANNE VON FURSTENBERG 3.4oz SPY W,35.00, $15.00 
2, W- DIESEL PLUS PLUS 2.5oz SPY EDT W (WHITE),30.00, $10.00 
2, W- DIESEL ZERO PLUS 2.5oz SPY EDT W (RED),30.00, $10.00 
2, W- DKNY 3.4oz SPY EDP W,58.00, $38.00 
2, W- DKNY BE DELICIOUS 3.4oz SPY EDP W,55.00, $35.00 
2, W- DKNY BE DELICIOUS FRESH BLOSSOM 3.4oz SPY EDP W,68.00, $48.00 
2, W- DKNY BE DELICIOUS NIGHT 3.4oz SPY EDT W,55.00, $35.00 
2, W- DKNY CASHMERE MIST 3.4oz SPY EDT W,68.00, $48.00 
2, W- DKNY FALL 2013 3.4oz SPY EDP W ORANGE,55.00, $35.00 
2, W- DKNY SUMMER 2014 3.4oz SPY EDP W PURPLE,55.00, $35.00 
2, W- DKNY SUMMER ART 3.4oz SPY EDT W,55.00, $35.00 
2, W- DOLCE AND GABBANA DOLCE FLORAL DROPS 2.5oz SPY EDT W,65.00, $45.00 
2, W- DOLCE & GABBANA DOLCE 2.5oz SPY EDP W,65.00, $45.00 
2, W- DOLCE & GABBANA FEMME 3.3oz SPY EDP W (burgandy),65.00, $45.00 
2, W- DOLCE & GABBANA FEMME INTENSE 3.3oz SPY EDP W,65.00, $45.00 
2, W- DOLCE & GABBANA LIGHT BLUE 3.3oz SPY EDT W,65.00, $45.00 
2, W- DOLCE & GABBANA LIGHT BLUE DREAMING IN PORTOFINO 3.3oz SPY EDT W,65.00, $45.00 
2, W- DOLCE & GABBANA THE ONE DESIRE INTENSE 2.5oz SPY EDP W,65.00, $45.00 
2, W- DONNA THE BEAST 3.0oz SPY EDP W,25.00, $5.00 
2, W- DORALL VARIOUS 3.4oz SPY EDP W,22.00, $2.00 
2, W- ELIZABETH ARDEN 5th AVENUE 4.2oz SPY EDP W,40.00, $20.00 
2, W- ELIZABETH ARDEN 5th AVENUE NYC 4.2oz SPY EDP W,45.00, $25.00 
2, W- ELIZABETH ARDEN 5th AVENUE STYLE 4.2oz SPY EDT W,40.00, $20.00 
2, W- ELIZABETH ARDEN ARDEN BEAUTY 3.4oz SPY EDP W,35.00, $15.00 
2, W- ELIZABETH ARDEN BLUE GRASS 3.3oz SPY EDP W,38.00, $18.00 
2, W- ELIZABETH ARDEN MEDITERRANEAN 3.3oz SPU EDP W,40.00, $20.00 
2, W- ELIZABETH ARDEN PROVOCATIVE 3.4oz SPY EDP W,45.00, $25.00 
2, W- ELIZABETH ARDEN RED DOOR AURA 3.4oz SPY EDT W,45.00, $25.00 
2, W- ELIZABETH ARDEN RED DOOR SHIMMER 3.4oz SPY EDP W,45.00, $25.00 
2, W- ELIZABETH ARDEN SUNFLOWERS 3.4oz SPY EDT W,35.00, $15.00 
2, W- ELIZABETH ARDEN TRUE LOVE 3.4oz SPY EDT W,35.00, $15.00 
2, W- ELIZABETH TAYLOR BLACK PEARLS 3.4oz SPY EDP W,30.00, $10.00 
2, W- ELIZABETH TAYLOR DIAMONDS & EMERALDAS 3.3oz SPY EDT W,30.00, $10.00 
2, W- ELIZABETH TAYLOR DIAMONDS & RUBIES 3.4oz SPY EDP W,30.00, $10.00 
2, W- ELIZABETH TAYLOR DIAMONDS & SAPPHIRES 3.3oz SPY EDT W,30.00, $10.00 
2, W- ELIZABETH TAYLOR FOREVER ELIZABETH 3.4oz SPY EDP W,38.00, $18.00 
2, W- ELIZABETH TAYLOR GARDENIA 3.4 SPY EDP W,35.00, $15.00 
2, W- ELIZABETH TAYLOR PASSION 2.5oz SPY EDT W,38.00, $18.00 
2, W- ELIZABETH TAYLOR VIOLET EYES 3.4oz zo SPY EDP W,40.00, $20.00 
2, W- ELIZABETH TAYLOR WHITE DIAMONDS 3.3oz SPY EDT W,45.00, $25.00 
2, W- ELLEN TRACY FASHIONISTA 2.5oz SPY EDP W,30.00, $10.00 
2, W- ELLEN TRACY LOVE NOTES 3.4oz SPY EDP W,35.00, $15.00 
2, W- EMANUEL UNGARO APPARITION SKY 3.0oz SPY EDT W,40.00, $20.00 
2, W- EMANUEL UNGARO DIVA 3.4oz SPY EDT W,45.00, $25.00 
2, W- EMPER BIANCA 3.3oz SPY EDP W,28.00, $8.00 
2, W- EMPER TIMIRA 3.3oz SPY EDP W,28.00, $8.00 
2, W- ESCADA DESIRE ME 2.5oz SPY EDP W,55.00, $35.00 
2, W- ESCADA INCREDIBLE ME 2.5oz SPY EDP W,55.00, $35.00 
2, W- ESCADA ISLAND KISS 3.4oz SPY EDT W,50.00, $30.00 
2, W- ESCADA MAGNETISM 2.5oz SPY EDP W,55.00, $35.00 
2, W- ESCADA MOON SPARKLE 3.3oz SPY EDP W,65.00, $45.00 
2, W- ESCADA ROCKIN RIO 3.4oz SPY EDT W,50.00, $30.00 
2, W- ESCADA SEXY GRAFFITI 3.3oz SPY EDT W,50.00, $30.00 
2, W- ESTEE LAUDER KNOWING 2.5oz SPY EDP W,75.00, $55.00 
2, W- ESTEE LAUDER MODERN MUSE 3.4oz SPY EDP W,80.00, $60.00 
2, W- ESTEE LAUDER PLEASURES 3.4oz SPY EDP W,68.00, $48.00 
2, W- ESTEE LAUDER PLEASURES BLOOM 3.4oz SPY EDP W,78.00, $58.00 
2, W- ESTEE LAUDER PURE WHITE LINEN 3.4oz SPY EDP W,75.00, $55.00 
2, W- ESTEE LAUDER SENSUOUS 3.4oz SPY EDP W,75.00, $55.00 
2, W- ESTEE LAUDER SENSUOUS NUDE 3.4oz SPY EDP W,75.00, $55.00 
2, W- ESTEE LAUDER TUSCANY DONNA 3.4oz SPY EDP W,78.00, $58.00 
2, W- ESTEE LAUDER WHITE LINEN 2.0oz SPY EDP W,60.00, $40.00 
2, W- ESTEE LAUDER YOUTH DEW 2.25oz SPY EDP W,50.00, $30.00 
2, W- ESTELLE EWEN EXQUISITE 3.4oz SPY EDT W,28.00, $8.00 
2, W- ESTELLE VENDOME E.S. 3.4oz SPY EDP W,28.00, $8.00 
2, W- ESTELLE VENDOME INTENSIVE 3.4oz SPY EDP W,28.00, $8.00 
2, W- ESTELLE VENDOME LIVE 2.5oz SPY EDP W,28.00, $8.00 
2, W- ESTELLE VENDOME LOVE 3.4oz SPY EDT W,29.00, $9.00 
2, W- ESTELLE VENDOME LOVELY PEARL 3.4oz SPY EDP W,29.00, $9.00 
2, W- EXCLAMATION 1.7oz SPY EDT W,28.00, $8.00 
2, W- FCUK 3.4oz SPY EDP W,35.00, $15.00 
2, W- FENDI LACQUAROSSA 2.5oz SPY EDP W,55.00, $35.00 
2, W- FRANCK OLIVER 2.5oz SPY EDT W,32.00, $12.00 
2, W- FRANCK OLIVER PRIVATE 2.5oz SPY EDP W,29.00, $9.00 
2, W- FRANCK OLIVER SUN JAVA 3.4OZ SPY EDP W,30.00, $10.00 
2, W- FRED HAYMANS BEVERLY HILLS 273 2.5oz SPY EDP W,38.00, $18.00 
2, W- FRED HAYMANS BEVERLY HILLS TOUCH 3.3 SPY EDT W,38.00, $18.00 
2, W- GABRIELA SABATINI 2.0oz SPY EDT W,35.00, $15.00 
2, W- GALE HAYMANS BEVELRY HILLS DELICIOUS 3.4oz SPY EDT W,30.00, $10.00 
2, W- GALE HAYMANS BEVELRY HILLS DELICIOUS FEELINGS 3.4oz SPY EDT W,30.00, $10.00 
2, W- GALE HAYMANS BEVELRY HILLS DELICIOUS HOT PINK 3.4oz SPY EDP W,33.00, $13.00 
2, W- GENDARME CARRIERE 2.0oz SPY EDT W,46.00, $26.00 
2, W- GIEFFEFFE 6.7oz SPY EDP W,50.00, $30.00 
2, W- GIORGIO ARMANI ARMANI CODE 2.5oz SPY EDP W,75.00, $55.00 
2, W- GIORGIO ARMANI ACQUA DI GIO 3.4oz SPY EDT W,70.00, $50.00 
2, W- GIORGIO ARMANI ACQUA DI GIOIA 3.4oz SPY EDP W,70.00, $50.00 
2, W- GIORGIO ARMANI EMPORIO 3.4oz SPY EDP W,75.00, $55.00 
2, W- GIORGIO ARMANI EMPORIO DIAMONDS 3.4oz SPY EDP W,75.00, $55.00 
2, W- GIORGIO ARMANI Si 3.4oz SPY EDP W,90.00, $70.00 
2, W- GIORGIO BEVERLY HILLS GIORGIO G 3.0oz SPY EDP W,38.00, $18.00 
2, W- GIORGIO BEVERLY HILLS GIORGIO RED 3.0oz SPY EDT W,40.00, $20.00 
2, W- GIORGIO BEVERLY HILLS GIORGIO 3.0oz SPY EDT W,40.00, $20.00 
2, W- GIORGIO BEVERLY HILLS WINGS 3.0oz SPY EDT W,35.00, $15.00 
2, W- GIVENCHY AMARIGE 3.3oz SPY EDT W,65.00, $45.00 
2, W- GIVENCHY ANGE OU DEMON 3.4oz SPY EDP W,65.00, $45.00 
2, W- GIVENCHY ANGE OU DEMON LE SECRET 3.4oz SPY EDP W,68.00, $48.00 
2, W- GIVENCHY ANGE OU DEMON SECRET ELIXIR 3.3oz SPY EDP W,68.00, $48.00 
2, W- GIVENCHY DAHLIA NOIR LEAU 4.2oz SPY EDT,75.00, $55.00 
2, W- GIVENCHY EAU TORRIDE 3.4oz SPY EDT W,58.00, $38.00 
2, W- GIVENCHY ORGANZA 3.3oz SPY EDP W,65.00, $45.00 
2, W- GIVENCHY PLAY 2.5oz SPY EDP W,58.00, $38.00 
2, W- GIVENCHY PLAY INTENSE 2.5oz SPY EDP W,58.00, $38.00 
2, W- GIVENCHY VERY IRRESISTIBLE 2.5oz SPY EDT W,58.00, $38.00 
2, W- GIVENCHY VERY IRRESISTIBLE ELECTRIC ROSE 1.7oz SPY EDT W,60.00, $40.00 
2, W- GIVENCHY VERY IRRESISTIBLE ELECTRIC ROSE 2.5oz SPY EDT W,65.00, $45.00 
2, W- GIVENCHY VERY IRRESISTIBLE SUMMER VIBRATIONS 2.5oz SPY EDT W,58.00, $38.00 
2, W- GIVENCHY YSATIS 3.4oz SPY EDT W,65.00, $45.00 
2, W- GUCCI by GUCCI 2.5oz SPY EDT W (PINK),60.00, $40.00 
2, W- GUCCI FLORA 2.5oz SPY EDT W,65.00, $45.00 
2, W- GUCCI FLORA GLAMOROUS MANDARIN 3.3oz SPY EDT W,65.00, $45.00 
2, W- GUCCI GUILTY 2.5oz SPY EDT W,65.00, $45.00 
2, W- GUCCI GUILTY DIAMOND 2.5oz SPY EDT W,68.00, $48.00 
2, W- GUCCI GUILTY INTENSE 2.5oz SPY EDP W,65.00, $45.00 
2, W- GUCCI PREMIERE 2.5oz SPY EDT W,65.00, $45.00 
2, W- GUCCI RUSH 2.5oz SPY EDT W,65.00, $45.00 
2, W- GUERLAIN CHAMPS ELYSESS 2.5oz SPY EDP W,65.00, $45.00 
2, W- GUERLAIN IDYLLE 2.5oz SPY EDT W,60.00, $40.00 
2, W- GUERLAIN INSOLENCE 3.4oz SPY EDT W,68.00, $48.00 
2, W- GUERLAIN LINSTANT 2.7oz SPY EDT W,68.00, $48.00 
2, W- GUERLAIN LA PETITE ROBE NOIR 3.3oz SPY EDT W,70.00, $50.00 
2, W- GUERLAIN MITSOUKO 2.5oz SPY EDP W,65.00, $45.00 
2, W- GUERLAIN SAMSARA 3.4oz SPY EDP W,75.00, $55.00 
2, W- GUERLAIN SHALIMAR 2.5 EDC SPY W,55.00, $35.00 
2, W- GUESS DARE 3.4oz SPY EDT W,35.00, $15.00 
2, W- GUESS GIRL BELLE 3.4oz SPY EDT W,40.00, $20.00 
2, W- GUESS MARCIANO 3.4oz SPY EDP W,35.00, $15.00 
2, W- GUESS SEDUCTIVE 2.5oz SPY EDT W,38.00, $18.00 
2, W- GUY LAROCHE FIDJI 3.4oz SPY EDT W,58.00, $38.00 
2, W- GWEN STEFANI HARAJUKU LITTLE ANGEL 1.0oz SPY W,30.00, $10.00 
2, W- GWEN STEFANI HARAJUKU LOVER MUSIC 1.0oz SPY W,30.00, $10.00 
2, W- HALLE BERRY PURE ORCHID 3.4oz SPY EDP W,38.00, $18.00 
2, W- HALLE by HALLE BERRY 3.4oz SPY EDP W,35.00, $15.00 
2, W- HALLOWEEN BLUE DROP by JESUS DEL POZO 3.4oz SPY EDT W,45.00, $25.00 
2, W- HALLOWEEN by JESUS DEL POZO 3.4oz SPY EDT W,45.00, $25.00 
2, W- HALLOWEEN FEVER by JESUS DEL POZO 3.4oz SPY EDT W,40.00, $20.00 
2, W- HALLOWEEN FLEUR by JESUS DEL POZO 3.4oz SPY EDT W,48.00, $28.00 
2, W- HALLOWEEN FRESIA by JESUS DEL POZO 3.4oz SPY EDT W,45.00, $25.00 
2, W- HALLOWEEN SEXY KISS by JESUS DEL POZO 3.4oz SPY EDT W,40.00, $20.00 
2, W- HALLOWEEN SUN by JESUS DEL POZO 3.4oz SPY EDT W,40.00, $20.00 
2, W- HALLOWEEN WATER LYLY by JESUS DEL POZO 3.4oz SPY EDT W,40.00, $20.00 
2, W- HALSTON 3.4oz SPY COL W,35.00, $15.00 
2, W- HALSTON CATALYS 3.4oz SPY EDT W,28.00, $8.00 
2, W- HANAE MORI 3.4oz SPY EDT W,50.00, $30.00 
2, W- HARD CANDY 3.4oz SPY EDP W,38.00, $18.00 
2, W- HERMES 24 FAUBOURG 3.4oz SPY EDT W,105.00, $85.00 
2, W- HERMES CALECHE 3.4oz SPY EDT W,105.00, $85.00 
2, W- HERMES CONCENTRE D ORANGE VERTE 3.3oz SPY EDT W,95.00, $75.00 
2, W- HERMES PAMPLEMOUSSE ROSE 3.4oz SPY EDC W,95.00, $75.00 
2, W- HERMES UN JARDIN SUR LE NIL 3.4oz SPY EDT W,95.00, $75.00 
2, W- HERVE LEGER ROSE LEGER 3.0oz SPY EDP W,45.00, $25.00 
2, W- HISTOIRE D AMOUR 3.4oz SPY EDT W,35.00, $15.00 
2, W- HUGO BOSS BOSS WOMAN (WHITE BOX) 3.0oz SPY EDP W,55.00, $35.00 
2, W- HUGO BOSS HUGO DEEP RED 3.0oz SPY EDT W,50.00, $30.00 
2, W- HUGO BOSS JOUR 2.5oz SPY EDP W,55.00, $35.00 
2, W- HUGO BOSS NUIT INTENSE 2.5oz SPY EDP W,50.00, $30.00 
2, W- HUGO BOSS ORANGE SUNSET WOMAN 2.5oz SPY W,50.00, $30.00 
2, W- HUGO BOSS ORANGE WOMAN 2.5oz SPY EDT W,55.00, $35.00 
2, W- HUGO BOSS XX 3.3oz SPY EDT W,48.00, $28.00 
2, W- ICEBERG EFFUSION 3.4 SPY EDT M,35.00, $15.00 
2, W- ICEBERG TWICE 3.4oz SPY EDT W,35.00, $15.00 
2, W- ISABELLA NERUSHAY ENTRE 2 3.4oz SPY EDP W,28.00, $8.00 
2, W- ISSEY MIYAKE A SCENT3.4oz SPY EDT W,70.00, $50.00 
2, W- ISSEY MIYAKE LEAU DISSEY 3.4oz SPY EDT W,65.00, $45.00 
2, W- ISSEY MIYAKE LEAU DISSEY MIYAKE SUMMER GREEN 3.4OZ SPY EDT W,75.00, $55.00 
2, W- ISSEY MIYAKE LEAU DISSEY MIYAKE SUMMER ORANGE 3.4oz SPY EDT W,75.00, $55.00 
2, W- J-LO BLUE GLOW 3.4oz EDT SPY W,43.00, $23.00 
2, W- J-LO EAU de GLOW 3.4oz EDT SPY W,43.00, $23.00 
2, W- J-LO GLOW AFTER DARK 3.4oz SPY EDP W,40.00, $20.00 
2, W- J-LO GLOW LA 3.4oz EDT SPY,40.00, $20.00 
