PAGINA,DESCRIPCION,PRECIO,
2, W-SET PERRY ELLIS 18 (4pcs) 3.4oz SPY EDT+0.25oz SPY EDT+2.75ozB.L+3.0oz S.G W,50.00, $25.00 
2, W-SET PERRY ELLIS 18 SENSUAL (4pcs) 3.4oz SPY EDP+0.25oz SPY EDP+2.75oz BODY LOTION +3.0oz SHOWER GEL W,50.00, $25.00 
2, W-SET PERRY ELLIS 360* (4pcs) 3.4oz SPY EDT+0.25oz SPY EDT+3.0ozB.L+3.0oz S.G W,48.00, $23.00 
2, W-SET PERRY ELLIS 360* RED (4pcs) 3.4oz SPY EDP+3.0oz B.L+3.0oz S.G+.25 EDP W,48.00, $23.00 
2, W-SET PERRY ELLIS F (4pcs) 3.4oz SPY EDP + .25oz SPY EDP + 3.0oz SHOWER GEL + 3.0oz BODY LOTION W,50.00, $25.00 
2, W-SET PERRY ELLIS HER (4pcs) 4.2oz SPY EDP + .25oz SPY EDP + 3.0oz SHOWER GEL + 3.0oz BODY LOTION W,48.00, $23.00 
2, W-SET PERRY ELLIS NEW! (3pcs) 3.4oz SPY EDP + 3.0oz BODY LOTION + 3.0oz SHOWER GEL W,53.00, $28.00 
2, W-SET PERRY ELLIS WOMAN (4pcs) 4.2oz SPY EDP + .25oz SPY EDP + 3.0oz SHOWER GEL + 3.0oz BODY LOTION W,48.00, $23.00 
2, W-SET PITBULL (3pcs) 3.4oz SPY EDT + 3.4oz S.G + 3.4oz B.L W,50.00, $25.00 
2, W-SET PRADA MILLANO INFUSION DIRIS (3pcs) 3.4oz SPY EDT+3.4oz B.L+BRAND NAME COSMETIC BAG W,80.00, $55.00 
2, W-SET QUEEN by QUEEN LATIFAH (3pcs) 3.4oz SPY EDP+3.0oz B.L + 3.0oz BODY BUTTER W,43.00, $18.00 
2, W-SET REMY LATOUR LUNE DETE (2pcs) 1.6oz SPY EDP + 5.0oz DEODORANT SPY W,33.00, $8.00 
2, W-SET RIHANNA REBEL FLEUR (3pcs) 3.4oz SPY EDP+3.0oz BODY LOTION + 3.0oz SHOWER GEL W,53.00, $28.00 
2, W-SET SEAN JOHNN EMPRESS (2pcs) 3.4oz SPY EDP + 6.7oz BODY LOTION W,75.00, $50.00 
2, W-SET SEAN JOHNN UNFORGIVABLE (3pcs) 4.2oz SPY EDP 3.4oz S.G + 3.4oz B.L W,73.00, $48.00 
2, W-SET SELENA GOMEZ (4pcs) 3.4oz SPY EDP + .5oz SPY EDP 4.0oz BODY LOTION + 4.0oz SHOWER GEL W,50.00, $25.00 
2, W-SET SHAKIRA S EAU FLORALE (3pcs) 2.7oz SPY EDT + 3.4oz BODY LOTION + 0.5oz LIP BALM W,43.00, $18.00 
2, W-SET SHAKIRA S (2pcs) 2.7oz SPY EDT + 3.4oz BODY LOTION W,43.00, $18.00 
2, W-SET SHAKIRA ELIXIR (2pcs) 2.7oz SPY EDT + 3.4oz BODY LOTION W,43.00, $18.00 
2, W-SET SHAKIRA WILD ELIXIR (2pcs) 2.7oz SPY EDT + 3.4oz BODY LOTION W,43.00, $18.00 
2, W-SET SOFIA VERGARA LOVE (3pcs) 3.4oz SPY EDP+3.4oz B.L+10ml PEN SPY EDP W,60.00, $35.00 
2, W-SET STAR (4pcs) 1.7oz SPY EDP + .67oz SPY EDP + 5.0oz BODY LOTION + 5.0oz SHOWER GEL W,35.00, $10.00 
2, W-SET SWISS ARMY (2pcs ) 3.4oz SPY EDT+2.5oz DEO W,50.00, $25.00 
2, W-SET TAYLOR SWIFT WONDERSTRUCK (3pcs) 3.4oz SPY EDP+3.4oz B.L+3.4oz S.G W,50.00, $25.00 
2, W-SET THIERRY MUGLER ANGEL INNOCENT (3pcs) 1.7oz SPY EDP + 3.3oz BODY MILK + COSMETIC BAG W,70.00, $45.00 
2, W-SET TRUE RELIGION LOVE HOPE DEMIN (4pcs) 3.4oz SPY EDP+ 3.0oz BODY LOTION+ 3.0oz SHOWER GEL+ 7.5ml SPY EDP,50.00, $25.00 
2, W-SET VANILLA FIELDS (2pcs) 2.0oz SPT EDC + 1.0oz SPY EDC W,35.00, $10.00 
2, W-SET VERSACE BRIGHT CRYSTAL ABSOLU (3pcs) 3.0oz SPY EDT + 3.4oz BODY LOTION + VERSACE COSMETIC BAG W,75.00, $50.00 
2, W-SET VERSACE CRYSTIAL NOIR (3pcs) 3.4oz SPY EDP +1.0oz SPY EDT+ VERSACE COSMETIC BAG +W,75.00, $45.00 
2, W-SET VERSACE VANITAS (3pcs) 3.4oz SPY EDT + 3.4oz B.L.+BRAND NAME COSMETIC BAG W,75.00, $45.00 
2, W-SET VERSACE VERSUS (3pcs) 3.4oz SPY EDT + 3.4oz BODY LOTION + BRAND NAME COSMETIC BAG,75.00, $50.00 
2, W-SET VERSACE YELLOW DIAMON (3pcs) 3.0oz SPY EDT + 3.4oz B.L.+BRAND NAME COSMETIC BAG W,75.00, $45.00 
2, W-SET VINCE CAMUTO FEMME (3pcs) 3.4oz SPY EDP + .25oz EDP +5.0oz BODY LOTION W,65.00, $40.00 
2, W-SET WHITE SHOULDERS (3pcs) 4.5oz SPY EDC + 0.25oz SPL EDP + 3.3oz BODY LOTION W,45.00, $20.00 
2, W-SET YVES DE SISTELLE by INCIDENCE (2pcs) 3.3oz SPY EDP + 3.3oz BODY LOTION W (MADE IN FRANCE),37.00, $12.00 
3,M- 4711 13.50oz SPL COL,40.00, $20.00 
3,M- 4711 27.0 OZ SPL,55.00, $35.00 
3,M- ADIDAS FRESH IMPACT 3.4oz SPY EDT M,25.00, $5.00 
3,M- ADIDAS TEAM FORCE 3.4oz SPY EDT M,25.00, $5.00 
3,"M- ALFRED SUNG ""SUNG"" 3.4oz SPY EDT M",35.00, $15.00 
3,M- ALFRED SUNG HEI 3.4oz SPY EDT M,36.00, $16.00 
3,M- ALFRED SUNG PARADISE 3.4oz SPY EDT M,35.00, $15.00 
3,M- ANIMALE 3.4oz SPY EDT MEN,38.00, $18.00 
3,M- ANIMALE 6.8oz SPY EDT MEN,48.00, $28.00 
3,M- ANIMALE AZUL 3.4OZ SPY M,38.00, $18.00 
3,M- ANIMALE SPORT 3.4oz SPY EDT MEN,40.00, $20.00 
3,M- ANTONIO BANDERAS BLUE ELECTRIC SEDUCTION 3.4oz SPY EDT M,40.00, $20.00 
3,M- ANTONIO BANDERAS COCKTAIL SEDUCTION BLUE 3.4oz SPY EDT M,40.00, $20.00 
3,M- ANTONIO BANDERAS COCKTAIL SEDUCTION IN BLACK 3.4oz SPY EDT M,40.00, $20.00 
3,M- ANTONIO BANDERAS DIAVOLO 6.7oz SPY EDT MEN,40.00, $20.00 
3,M- ANTONIO BANDERAS MEDITERRANEO 3.4oz SPY EDT M,35.00, $15.00 
3,M- ANTONIO BANDERAS SEDUCTION IN BLACK 3.4oz SPY EDT M,38.00, $18.00 
3,M- ANTONIO BANDERAS SEDUCTION IN BLACK 6.8oz SPY EDT M,50.00, $30.00 
3,M- ANTONIO BANDERAS SPIRIT 3.4oz SPY EDT M,35.00, $15.00 
3,M- ANTONIO BANDERAS THE GOLDEN SECRET 6.7oz SPY EDT M,45.00, $25.00 
3,M- ANTONIO BANDERAS THE SECRET 3.4oz SPY EDT M,38.00, $18.00 
3,M- ANUCCI 3.4 SPY EDT,45.00, $25.00 
3,M- AQUA DI SELVA 3.4 SPY EDC M,35.00, $15.00 
3,M- ASPEN 4.0oz SPY MEN,28.00, $8.00 
3,M- AZZARO 6.8oz SPY M,55.00, $35.00 
3,M- AZZARO CHROME 3.3oz EDT SPY M,45.00, $25.00 
3,M- AZZARO CHROME 6.8oz SPY EDT M,55.00, $35.00 
3,M- AZZARO CHROME LEGEND 4.2oz SPY EDT M,45.00, $25.00 
3,M- AZZARO CHROME SPORT 3.4oz SPY EDT M,45.00, $25.00 
3,M- AZZARO DECIBEL 3.4oz SPY EDT MEN,50.00, $30.00 
3,M- AZZARO LEAU by AZZARO 3.4oz SPY EDT M,50.00, $30.00 
3,M- AZZARO NOW 2.7oz SPY EDT M,48.00, $28.00 
3,M- AZZARO POUR HOMME 3.4 SPY EDT MEN,45.00, $25.00 
3,M- AZZARO SILVER BLACK 3.4OZ SPY M,48.00, $28.00 
3,M- BANNANA REPUBLIC (Classic) 3.4oz SPY EDT,45.00, $25.00 
3,M- BENETTON B UNITED 3.4oz SPY EDT,30.00, $10.00 
3,M- BENETTON COLORS 3.4oz SPY EDT M,30.00, $10.00 
3,M- BENETTON NERO 3.4oz SPY EDT M,30.00, $10.00 
3,M- BENETTON VERDE 3.4oz SPY EDT M,30.00, $10.00 
3,M- BIJAN 2.5 SPY EDT MEN,35.00, $15.00 
3,M- BIJAN BLACK 3.4oz SPY EDT M,35.00, $15.00 
3,M- BOUCHERON 3.3oz SPY EDT M,48.00, $28.00 
3,M- BOUCHERON JAIPUR 3.4 SPY EDT MEN,48.00, $28.00 
3,M- BOUCHERON PARFUMS DE JOAILLIER 3.3oz SPY EDT M,55.00, $35.00 
3,M- BRUT (CLASSIC) 3.0 SPY EDC,28.00, $8.00 
3,M- BRUT BLACK 3.0 SPY EDC,30.00, $10.00 
3,M- BRUT BLUE 3.0 SPY EDC,30.00, $10.00 
3,M- BURBERRY 3.4oz SPY EDT M,48.00, $28.00 
3,M- BURBERRY BRIT 3.4oz SPY EDT M,48.00, $28.00 
3,M- BURBERRY BRIT RHYTHM INTENSE 3.0oz SPY EDT M,50.00, $30.00 
3,M- BURBERRY LONDON FABRIC 3.4oz SPY EDT M,50.00, $30.00 
3,M- BURBERRY THE BEAT 3.4oz SPY EDT M,50.00, $30.00 
3,M- BURBERRY TOUCH 3.4oz SPY EDT SPY M,50.00, $30.00 
3,M- BURBERRY WEEKEND 3.3oz SPY EDT M,48.00, $28.00 
3,M- BVLGARI AQVA 3.4oz SPY EDT M,50.00, $30.00 
3,M- BVLGARI AQVA AMARA 3.4oz SPY EDT M,50.00, $30.00 
3,M- BVLGARI AQVA MARINE 5.0zo SPY EDT M,60.00, $40.00 
3,M- BVLGARI AQVA MARINE TONIQ 3.4zo SPY EDP M,58.00, $38.00 
3,M- BVLGARI AQVA TONIQ 3.4zo SPY EDP M,50.00, $30.00 
3,M- BVLGARI BLACK 2.5oz SPY EDT M,48.00, $28.00 
3,M- BVLGARI BLV 3.4 SPY EDT M,50.00, $30.00 
3,M- BVLGARI HOMME EXTREME 3.4oz SPY EDT M,50.00, $30.00 
3,M- BVLGARI MAN 3.4oz SPY EDT M,50.00, $30.00 
3,M- BVLGARI MAN EXTREME 3.4oz SPY EDT M,50.00, $30.00 
3,M- BVLGARI MAN IN BLACK 3.4oz SPY EDP M,58.00, $38.00 
3,M- BVLGARI POUR HOME 3.4oz SPY EDT M,50.00, $30.00 
3,M- BVLGARI SOIR 3.4oz SPY EDT M,50.00, $30.00 
3,M- CAESARS 4.0 SPY MEN,32.00, $12.00 
3,M- CAFE 3.4 SPY EDT M,28.00, $8.00 
3,M- CAFE CAFE 3.4oz SPY M,28.00, $8.00 
3,M- CAFE CAFE PURO 3.4 SPY EDT M,29.00, $9.00 
3,M- CAFE CAFEINA 3.4oz SPY EDT MEN,28.00, $8.00 
3,M- CALVIN KLEIN CK BE 6.7oz SPY EDT M,48.00, $28.00 
3,M- CALVIN KLEIN CK ONE 6.7oz SPY EDT M,45.00, $25.00 
3,M- CALVIN KLEIN CK ONE IN 2 U 5.0oz SPY EDT M,48.00, $28.00 
3,M- CALVIN KLEIN CONTRADICTION 3.4oz SPY MEN,45.00, $25.00 
3,M- CALVIN KLEIN ENCOUNTER 6.2oz SPY EDT M,58.00, $38.00 
3,M- CALVIN KLEIN ENCOUNTER FRESH 3.4oz SPY EDT M,48.00, $28.00 
3,M- CALVIN KLEIN ESCAPE 3.4oz SPY EDT M,45.00, $25.00 
3,M- CALVIN KLEIN ETERNITY AQUA 6.8oz SPY EDT M,60.00, $40.00 
3,M- CALVIN KLEIN ETERNITY SUMMER 3.4oz SPY EDT M,45.00, $25.00 
3,M- CALVIN KLEIN EUPHORIA 3.4oz SPY EDT M,48.00, $28.00 
3,M- CALVIN KLEIN MAN 3.4oz SPY EDT M,45.00, $25.00 
3,M- CALVIN KLEIN OBSESSION 4.0oz SPY EDT M,45.00, $25.00 
3,M- CALVIN KLEIN REVEAL 3.4 oz SPY EDT M,48.00, $28.00 
3,M- CALVIN KLEIN TRUTH 3.4oz SPY EDT M,48.00, $28.00 
3,M- CAPTURE 3.4 SPY EDT M,27.00, $7.00 
3,M- CARLO CORINTO 3.4oz SPY EDT,45.00, $25.00 
3,M- CARLO CORINTO 315 3.4 SPY EDT,45.00, $25.00 
3,M- CARLO CORINTO LInizio 3.3oz SPY EDT M,40.00, $20.00 
3,M- CAROLINA HERRERA CH 3.4oz SPY EDT M,68.00, $48.00 
3,M- CAROLINA HERRERA CH SPORT 3.4 oz SPY EDT M,55.00, $35.00 
3,M- CAROLINA HERRERA 212 3.4oz SPY EDT M,65.00, $45.00 
3,M- CAROLINA HERRERA 212 GLAM 3.4oz SPY EDT M,75.00, $55.00 
3,M- CAROLINA HERRERA 212 SEXY 3.4oz SPY EDT M,65.00, $45.00 
3,M- CAROLINA HERRERA 212 SURF 3.4oz SPY EDT M,70.00, $50.00 
3,M- CAROLINA HERRERA CHIC 3.4oz SPY EDT M,58.00, $38.00 
3,M- CAROLINA HERRERA HERRERA 3.4oz SPY EDT MEN,60.00, $40.00 
3,M- CAROLINA HERRERA HERRERA 6.7oz SPY EDT MEN,75.00, $55.00 
3,M- CARON ROYAL BAIN DE CHAMPAGNE 8.0SPL EDT MEN,48.00, $28.00 
3,M- CARTIER DECLARATION 3.4oz SPY EDT M,55.00, $35.00 
3,M- CARTIER DECLARATION 5.0oz SPY EDT M,68.00, $48.00 
3,M- CARTIER DECLARATION ESSENCE 3.4OZ SPY MEN,55.00, $35.00 
3,M- CARTIER DECLARATION LEAU 3.4oz SPY MEN,55.00, $35.00 
3,M- CARTIER EAU DE CARTIER 6.8oz SPY EDT,60.00, $40.00 
3,M- CARTIER EAU ESSENCE DORANGE 6.7oz SPY EDT U M,70.00, $50.00 
3,M- CARTIER PASHA 3.4oz SPY EDT M,58.00, $38.00 
3,M- CARTIER PASHA EDITION NOIRE 3.4oz SPY EDT M,65.00, $45.00 
3,M- CARTIER ROADSTER 3.4oz SPY EDT M,55.00, $35.00 
3,M- CARTIER ROADSTER SPORT 3.4oz SPY EDT M,60.00, $40.00 
3,M- CARTIER SANTOS DE CARTIER 3.4 SPY EDT,55.00, $35.00 
3,M- CERRUTI 1881 3.4oz SPY EDT M,40.00, $20.00 
3,M- CERRUTI 1881 BLACK 3.4oz SPY EDT M,45.00, $25.00 
3,M- CERRUTI IMAGE 3.4 SPY EDT M,45.00, $25.00 
3,M- CHIVALRY 3.4OZ SPL M,45.00, $25.00 
3,M- CHRISTIAN DIOR DIOR HOMME COLOGNE 4.2oz SPY EDC M,75.00, $55.00 
3,M- CHRISTIAN DIOR DIOR HOMME INTENSE 3.4oz SPY EDT M,78.00, $58.00 
3,M- CHRISTIAN DIOR FAHRENHEIT 3.4oz SPY EDT M,75.00, $55.00 
3,M- CLINIQUE HAPPY CLINIQUE 3.4oz SPY EDC M,58.00, $38.00 
3,M- CORDUROY 2.5oz SPY M,30.00, $10.00 
3,M- CUBA 1.17oz SPY,22.50, $2.50 
3,M- CUBA 3.4oz SPY EDT M,25.00, $5.00 
3,M- DADDY YANKEE 3.4oz SPY EDT M,35.00, $15.00 
3,M- DAVIDOFF CHAMPION ENERGY 3.0oz SPY EDT M,48.00, $28.00 
3,M- DAVIDOFF COOL WATER 4.2oz SPY EDT M,45.00, $25.00 
3,M- DAVIDOFF COOL WATER 6.8oz SPY EDT M,55.00, $35.00 
3,M- DAVIDOFF COOL WATER NIGHT DIVE 4.2oz SPY EDT M,45.00, $25.00 
3,M- DAVIDOFF ECHO 3.4oz SPY EDT M,45.00, $25.00 
3,M- DAVIDOFF HOT WATER 3.7 oz SPY EDT MEN,45.00, $25.00 
3,M- DAVIDOFF SILVER SHADOW 3.4 SPY M,45.00, $25.00 
3,M- DAVIDOFF ZINO 4.2oz SPY EDT M,45.00, $25.00 
3,M- DEODORANTS 150 ML,21.00, $1.00 
3,M- DIESEL FUEL FOR LIFE 4.2oz SPY EDT M,75.00, $55.00 
3,M- DIESEL ONLY THE BRAVE WILD 4.2oz SPY EDT M,68.00, $48.00 
3,M- DIESEL PLUS PLUS 2.5oz SPY EDT M (WHITE),30.00, $10.00 
3,M- DIESEL ZERO PLUS 2.5 SPY EDT M (RED),30.00, $10.00 
3,M- DKNY 3.4 SPY EDT M,60.00, $40.00 
3,M- DKNY MEN 3.54oz SPY EDT M,55.00, $35.00 
3,M- DOLCE & GABBANA 6.8oz SPY EDT M (200ml),70.00, $50.00 
3,M- DOLCE & GABBANA INTENSO 4.2oz SPY EDT M,68.00, $48.00 
3,M- DOLCE & GABBANA LIGHT BLUE 4.2oz SPY EDT M,60.00, $40.00 
3,M- DOLCE & GABBANA LIGHT BLUE 6.8oz SPY EDT M (200ml),70.00, $50.00 
3,M- DOLCE & GABBANA THE ONE 3.4oz SPY EDT M,60.00, $40.00 
3,M- DOLCE & GABBANA THE ONE GENTLEMEN 3.3oz SPY EDT M,58.00, $38.00 
3,M- DONALD TRUMP SUCCESS 3.4oz SPY EDT MEN,40.00, $20.00 
3,M- DORALL VARIOUS 3.4oz SPY EDT M,22.00, $2.00 
3,M- DUNHILL LONDON 3.3oz SPY EDT M,55.00, $35.00 
3,M- DUNHILL BLACK 3.4oz SPY EDT M,55.00, $35.00 
3,M- DUNHILL CUSTOM 3.4 SPY EDT M,45.00, $25.00 
3,M- DUNHILL D 3.3 SPY EDT M,40.00, $20.00 
3,M- DUNHILL DESIRE BLUE 3.4oz SPY EDT M,45.00, $25.00 
3,M- DUNHILL DESIRE RED 3.4 SPY EDT M,48.00, $28.00 
3,M- DUNHILL DESIRE RED 5.0oz SPY EDT M,55.00, $35.00 
3,M- DUNHILL FRESH 3.4oz SPY EDT M,45.00, $25.00 
3,M- DUNHILL XCENTRIC 3.4 SPY EDT M,45.00, $25.00 
3,M- ED HARDY LOVE IS 3.4oz SPY EDT M,20.00, $-   
3,M- ELIZABETH ARDEN ARDEN MAN 3.4 SPY EDT M,45.00, $25.00 
3,M- ELIZABETH TAYLOR PASSION 4.2oz SPY COLOGNE MEN,35.00, $15.00 
3,M- EMANUEL UNGARO UNGARO III 3.4 SPY M,40.00, $20.00 
3,M- EMANUEL UNGARO APPARITION COBALT 3.4oz SPY EDT M,40.00, $20.00 
3,M- EMANUEL UNGARO HIM 3.4oz SPY EDT M,40.00, $20.00 
3,M- EMANUEL UNGARO MAN 3.0oz SPY EDT M,40.00, $20.00 
3,M- ENRIQUE IGLESIAS ADRENALINE 3.4oz SPY EDT M,40.00, $20.00 
3,M- ESTEE LAUDER ARAMIS 3.7oz SPY EDT M,48.00, $28.00 
3,M- ESTEE LAUDER ARAMIS 900 3.4 SPY EDT MEN,55.00, $35.00 
3,M- ESTEE LAUDER ARAMIS ADVENTURE 3.7oz SPY EDT M,55.00, $35.00 
3,M- ESTEE LAUDER ARAMIS DEVIN 3.5oz SPY EDT M,58.00, $38.00 
3,M- ESTEE LAUDER ARAMIS HAVANA 3.4 SPY EDT MEN,58.00, $38.00 
3,M- ESTEE LAUDER ARAMIS NEW WEST 3.4oz SPY M,55.00, $35.00 
3,M- ESTEE LAUDER ARAMIS TUSCANY 3.4 SPY EDT MEN,45.00, $25.00 
3,M- ESTEE LAUDER PLEASURES 3.4oz SPY EDT MEN,58.00, $38.00 
3,M- EXCEED 3.4 SPY EDT M,25.00, $5.00 
3,M- FAN DI FENDI ACQUA 3.3 SPY EDT MEN,55.00, $35.00 
3,M- FERRARI LIGHT ESSENCE 3.4oz SPY EDT M,40.00, $20.00 
3,M- FERRARI LIGHT ESSENCE ACQUA 3.4oz SPY EDT M,40.00, $20.00 
3,M- FERRARI SCUDERIA RACING RED 4.2oz SPY EDT M,40.00, $20.00 
3,M- FERRARI UOMO 3.4oz SPY EDT M,40.00, $20.00 
3,M- FRED HAYMANS BEVERLY HILLS 273 2.5 SPY COL. MEN,35.00, $15.00 
3,M- FRED HAYMANS BEVERLY HILLS HOLLYWOOD 3.4oz SPY EDT M,35.00, $15.00 
3,M- GEOFFREY BEENE GREY FLANNEL 4.0oz SPY MEN,32.00, $12.00 
3,M- GIORGIO ARMANI ARMANI CODE ICE 2.5oz SPY EDT M,75.00, $55.00 
3,"M- GIORGIO ARMANI ARMANI CODE ULTIMATE INTENSE"" 2.5oz SPY EDT M",75.00, $55.00 
3,M- GIORGIO ARMANI ARMANI CODE 4.2oz SPY EDT M,85.00, $65.00 
3,M- GIORGIO ARMANI ARMANI CODE 2.5oz SPY EDT M,70.00, $50.00 
3,M- GIORGIO ARMANI ARMANI EAU DE NUIT POUR HOMME 3.3oz SPY EDT MEN,75.00, $55.00 
3,M- GIORGIO ARMANI ARMANI MANIA 3.4oz SPY EDT M,75.00, $55.00 
3,M- GIORGIO ARMANI ACQUA DI GIO 3.4oz SPY EDT M,70.00, $50.00 
3,M- GIORGIO ARMANI ACQUA DI GIO 6.7oz SPY EDT MEN,85.00, $65.00 
3,M- GIORGIO ARMANI EMPORIO 3.4oz SPY EDT M,70.00, $50.00 
3,M- GIORGIO BEVERLY HILLS GIORGIO RED 3.4oz SPY EDT M,35.00, $15.00 
3,M- GIORGIO BEVERLY HILLS GIORGIO 4.0 SPY EDT M,38.00, $18.00 
3,M- GIORGIO BEVERLY HILLS WINGS 3.4oz SPY EDT M,35.00, $15.00 
3,M- GIVENCHY BLUE LABEL 3.3oz SPY EDT M,55.00, $35.00 
3,M- GIVENCHY GENTLEMAN ONLY 5.0oz SPY EDT M,65.00, $45.00 
3,M- GIVENCHY PI by GIVENCHY 3.4oz SPY EDT M,55.00, $35.00 
3,M- GIVENCHY PI NEO by GIVENCHY 3.4oz SPY EDT M,55.00, $35.00 
3,M- GIVENCHY PLAY 3.3oz SPY EDT M,58.00, $38.00 
3,M- GIVENCHY PLAY INTENSE 3.3oz SPY EDT M,58.00, $38.00 
3,M- GIVENCHY PLAY SPORT 3.3oz SPY EDT M,58.00, $38.00 
3,M- GIVENCHY POUR HOMME 3.4oz SPY EDT M,55.00, $35.00 
3,M- GIVENCHY XERYUS 3.4oz SPY EDT M,58.00, $38.00 
3,M- GIVENCHY XERYUS ROUGE 3.4oz SPY EDT M,55.00, $35.00 
3,M- GRABAZZI 4.0 SPY EDT,50.00, $30.00 
3,M- GUCCI GUILTY BLACK 3.0oz SPY EDT M,60.00, $40.00 
3,M- GUCCI GUILTY DIAMOND by GUCCI 3.0oz SPY EDT M,65.00, $45.00 
3,M- GUCCI GUILTY INTENSE 3.0oz SPY EDT M,60.00, $40.00 
3,M- GUCCI GUILTY STUD 3.0oz SPY EDT M,68.00, $48.00 
3,M- GUCCI MADE TO MEASURE 3.0oz SPY EDT M,58.00, $38.00 
3,M- GUERLAIN HABIT ROUGE 3.4 SPY,55.00, $35.00 
3,M- GUERLAIN HERITAGE 3.4oz SPY EDT M,68.00, $48.00 
3,M- GUERLAIN IMPERIALE 3.4 SPY EDC,58.00, $38.00 
3,M- GUERLAIN INSTANT 4.2oz SPY EDT M,58.00, $38.00 
3,M- GUERLAIN VETIVER 3.4oz SPY M,55.00, $35.00 
3,M- GUERLAIN VETIVER EXTREME 3.4oz SPY M,58.00, $38.00 
3,M- GUESS 2.5OZ SPY EDT M,40.00, $20.00 
3,M- GUESS by MARCIANO 3.4oz SPY EDT M,40.00, $20.00 
3,M- GUESS NIGHT 3.4oz SPY EDT M,38.00, $18.00 
3,M- GUESS NIGHT ACCESS 3.4oz SPY EDT M,38.00, $18.00 
3,M- GUESS SEDUCTIVE 3.4oz SPY EDT M,38.00, $18.00 
3,M- GUESS SEDUCTIVE BLUE 3.4oz SPY EDT M,38.00, $18.00 
3,M- GUY LAROCHE DRAKKAR 6.7oz SPY EDT M,55.00, $35.00 
3,M- GUY LAROCHE HORIZON 3.4 SPY EDT,58.00, $38.00 
3,M- HALLOWEEN ROCK ON by JESUS DEL POZO 4.2oz SPY EDT M,50.00, $30.00 
3,M- HALSTON CATALYST 3.4 SPY EDT MEN,38.00, $18.00 
3,M- HALSTON I-12 4.0 SPY EDC M,28.00, $8.00 
3,M- HALSTON Z-14 4.2oz SPY COLOGNE,35.00, $15.00 
3,M- HALSTON Z-14 8.0oz SPY COLOGNE,40.00, $20.00 
3,M- HANAE MORI 3.4 SPY EDT MEN,48.00, $28.00 
3,M- HANAE MORI 3.4oz SPY EAU DE PERFUM MEN,55.00, $35.00 
3,M- HANAE MORI HIM 3.4oz SPY EDP MEN,50.00, $30.00 
3,M- HERMES TERRE DHERMES 3.3oz SPY EDT M,78.00, $58.00 
3,M- HERMES TERRE DHERMES EAU TRES FRAICHE 4.2oz SPY EDT M,85.00, $65.00 
3,M- HIS 777 3.4oz SPY EDT M,30.00, $10.00 
3,M- HOMBRE CALIENTE 4.2oz SPY EDT M,28.00, $8.00 
3,M- HUGO BOSS # 1 4.2 SPY EDT,48.00, $28.00 
3,M- HUGO BOSS #6 3.4oz SPY EDT M,55.00, $35.00 
3,M- HUGO BOSS #6 UNLIMITED 3.4oz SPY EDT M,55.00, $35.00 
3,M- HUGO BOSS 6.7oz SPY EDT M (200ml),65.00, $45.00 
3,M- HUGO BOSS BALDESARINI AMBRE 3.0oz SPY EDT M,48.00, $28.00 
3,M- HUGO BOSS BALDESSARINI 2.5oz SPY EDT M,45.00, $25.00 
3,M- HUGO BOSS BALDESSARINI DEL MAR 3.0OZ SPY M,48.00, $28.00 
3,M- HUGO BOSS BALDESSARINI DEL MAR SEYCHELLES 3.0oz SPY M,48.00, $28.00 
3,M- HUGO BOSS BALDESSARINI STRICTLY PRIVATE 3.0oz SPY EDT M,48.00, $28.00 
3,M- HUGO BOSS DARK BLUE 2.5oz SPY EDT M,48.00, $28.00 
3,M- HUGO BOSS ELEMENTS NEW! 3.0oz SPY EDT M,50.00, $30.00 
3,M- HUGO BOSS ENERGISE 3.4 SPY EDT M,55.00, $35.00 
3,M- HUGO BOSS IN MOTION WHITE 3.0oz SPY EDT M,55.00, $35.00 
3,M- HUGO BOSS JUST DIFFERENT 3.4oz SPY EDT M,48.00, $28.00 
3,M- HUGO BOSS ORANGE by HUGO BOSS 3.3oz SPY M,58.00, $38.00 
3,M- HUGO BOSS RED 4.2oz SPY EDT M,50.00, $30.00 
3,M- HUGO BOSS SELECTION 3.0oz SPY MEN,50.00, $30.00 
3,M- HUGO BOSS SOUL 3.0oz SPY EDT M,50.00, $30.00 
3,M- HUGO BOSS XY by HUGO BOSS 3.3oz SPY EDT M,48.00, $28.00 
3,M- HUMMER 2 RED 4.2OZ SPY M,35.00, $15.00 
3,M- HUMMER 4.2oz SPY EDT M,35.00, $15.00 
3,M- HUMMER BLACK 4.2oz SPY EDT M,35.00, $15.00 
3,M- ISSEY MIYAKE LEAU BLEUE DISSEY MIYAKE 4.2oz SPY M,58.00, $38.00 
3,M- ISSEY MIYAKE LEAU DISSEY MIYAKE 6.7oz SPY EDT M,75.00, $55.00 
3,M- ISSEY MIYAKE LEAU DISSEY MIYAKE INTENSE 4.2oz SPY EDT M,70.00, $50.00 
3,M- ISSEY MIYAKE NIUT 6.7oz SPY EDT M,78.00, $58.00 
3,M- ISSEY MIYAKE SPORT 3.3oz SPY EDT M,58.00, $38.00 
3,M- J-LO DESEO 3.4oz SPY EDT M,40.00, $20.00 
3,M- JACOMO ROUGE 3.4 SPY EDT M,38.00, $18.00 
3,M- JACQUES FATH POUR HOMME 2.5oz SPY EDT M,45.00, $25.00 
3,M- JAGUAR CLASSIC AMBER 3.4oz SPY EDT M,35.00, $15.00 
3,M- JAGUAR GOLD 3.4oz SPY EDT M,35.00, $15.00 
3,M- JAGUAR MOTION 3.4oz SPY EDT M,35.00, $15.00 
3,M- JAGUAR CLASSIC BLUE 4.2oz SPY EDT M,35.00, $15.00 
3,M- JAGUAR CLASSIC RED 3.4oz SPY EDT M,35.00, $15.00 
3,M- JAGUAR PERFORMANCE 3.4oz SPY M,35.00, $15.00 
3,M- JEAN PAUL GAULTIER 4.2 SPY MEN,60.00, $40.00 
3,M- JEAN PAUL GAULTIER FLEUR DU MALE 4.2oz SPY EDT M,55.00, $35.00 
3,M- JEAN PAUL GAULTIER KOKO RICO 3.4oz SPY EDT M,70.00, $50.00 
3,"M- JENNI RIVERA EL SPORT"" 3.4oz SPY EDT M",55.00, $35.00 
3,M- JENNI RIVERA EL 3.4oz SPY EDT M,55.00, $35.00 
3,M- JIL SANDER 4.2oz SPY EDT M,48.00, $28.00 
3,M- JIVAGO 24K 3.4 SPY EDT M,55.00, $35.00 
3,M- JIVAGO SWEET DREAMS 3.4oz SPY EDT M,40.00, $20.00 
3,M- JOHN VARVATOS BLACK ARTISAN 3.4 SPY EDT MEN,58.00, $38.00 
3,M- JOOP GO 3.4oz SPY EDT M,45.00, $25.00 
3,M- JOOP GO 6.7oz SPY EDT M,50.00, $30.00 
3,M- JOOP NIGHTFLIGHT 4.2 SPY M,45.00, $25.00 
3,M- JOOP SPLASH SUMMER TICKET 3.8oz SPY EDT M,40.00, $20.00 
3,M- JOOP 4.2oz SPY EDT MEN,45.00, $25.00 
3,M- JOOP 6.7oz SPY EDT MEN,50.00, $30.00 
3,M- JOOP SUMMER TICKET 4.2oz SPY EDT MEN,48.00, $28.00 
3,M- JORDAN 23 by MICHAEL JORDAN 3.4oz SPY EDT M,35.00, $15.00 
3,M- JORDAN by MICHAEL 3.4oz SPY EDT M,35.00, $15.00 
3,M- JOVAN MUSK 3.0oz SPY EDT MEN,28.00, $8.00 
3,M- JOVAN MUSK BLACK 3.0oz SPY EDT MEN,28.00, $8.00 
3,M- JOVAN MUSK SEX APPEAL 3.0oz SPY EDT M,28.00, $8.00 
3,M- JOVAN MUSK WHITE 3.0oz SPY EDT M,28.00, $8.00 
3,M- JUICY COUTURE DIRTY ENGLISH 3.4oz SPY EDT M,60.00, $40.00 
3,M- KANON 3.4 SPY EDT M,35.00, $15.00 
3,M- KAREN LOW X CHANGE COOL 3.4 SPY EDT M,26.00, $6.00 
3,M- KENNETH COLE BLACK 3.4oz SPY EDT M,45.00, $25.00 
3,M- KENNETH COLE R.S.V.P. 3.4oz SPY EDT M,45.00, $25.00 
3,M- KENNETH COLE REACTION T-SHIRT 3.4oz SPY EDT M,48.00, $28.00 
3,M- KENNETH COLE REACTION THERMAL 3.4oz SPY EDT,48.00, $28.00 
3,M- KENNETH COLE SIGNATURE 3.4OZ SPY M,45.00, $25.00 
3,M- KENZO HOMME SPORT EXTREME 3.4oz SPY EDT MEN,55.00, $35.00 
3,M- KENZO JUNGLE 3.4 SPY EDT M,58.00, $38.00 
3,M- KRIZIA UOMO 3.4 SPY M,35.00, $15.00 
3,M- LACOSTE BOOSTER 4.2oz SPY EDT M,55.00, $35.00 
3,M- LACOSTE CHALLENGE REFRESH 3.0oz SPY EDT M,50.00, $30.00 
3,M- LACOSTE ESSENTIAL 4.2oz SPY EDT M,55.00, $35.00 
3,M- LACOSTE ESSENTIAL SPORT 4.2oz SPY EDT M,55.00, $35.00 
3,M- LACOSTE L.12.12 EAU DE BLEU 3.3oz SPY EDT M,50.00, $30.00 
3,M- LACOSTE L.12.12 EAU DE JAUNE (YELLOW) 3.3oz SPY EDT M,55.00, $35.00 
3,M- LACOSTE L.12.12 EAU DE JAUNE (YELLOW) 5.8oz SPY EDT M,60.00, $40.00 
3,M- LACOSTE L.12.12 EAU DE NOIR 3.3oz SPY EDT M,50.00, $30.00 
3,M- LACOSTE L.12.12 EAU DE NOIR 5.8oz SPY EDT M,65.00, $45.00 
3,M- LACOSTE LIVE 3.3oz SPY EDT M,65.00, $45.00 
3,M- LACOSTE POUR HOMME 3.3oz SPY EDT MEN,50.00, $30.00 
3,M- LAGERFELD 4.2oz SPY,38.00, $18.00 
3,M- LALIQUE LION 4.2 SPY EDT MEN,50.00, $30.00 
3,M- LALIQUE WHITE 4.2oz SPY EDT M,50.00, $30.00 
3,M- LAMIS CATSUIT 3.4 SPY EDT M,25.00, $5.00 
3,M- LAMIS COUNTRY CLUB BLACK 3.4oz SPY M,25.00, $5.00 
3,M- LAMIS COUNTRY CLUB BLUE DELUXE 3.4oz SPY EDT,25.00, $5.00 
3,M- LAMIS DIABLE BLUE 3.4 SPY EDT M,25.00, $5.00 
3,M- LAMIS EVERYONE 3.4oz SPY,25.00, $5.00 
3,M- LAMIS EVERYONE NOIR 3.4oz SPY EDT,25.00, $5.00 
3,M- LAMIS RESTRICTION DELUXE 3.4oz SPY EDT M,25.00, $5.00 
3,M- LANVIN AVANT GARDE 3.4oz SPY EDT M,40.00, $20.00 
3,M- LANVIN ECLAT DARPEGE 3.3oz SPY EDT M,48.00, $28.00 
3,M- LANVIN LHOMME 3.4oz SPY EDT M,45.00, $25.00 
3,M- LANVIN LHOMME SPORT 3.4 SPY EDT M,45.00, $25.00 
3,M- LANVIN OXYGENE 3.4 SPY EDT M,40.00, $20.00 
3,M- LAPIDUS 3.4oz SPY EDT MEN,35.00, $15.00 
3,M- LAPIDUS BLACK SOULD 3.4oz SPY EDT MEN,40.00, $20.00 
3,"M- LIZ CLAIBORNE ""CLAIBORNE"" 3.4 SPY EDT MEN",30.00, $10.00 
3,M- LIZ CLAIBORNE CLAIBORNE SPORT 3.4oz SPY EDT M,35.00, $15.00 
3,M- LIZ CLAIBORNE CURVE 4.2oz SPY EDC M,40.00, $20.00 
3,M- LIZ CLAIBORNE CURVE CONNECT 4.2oz SPY EDT M,35.00, $15.00 
3,M- LIZ CLAIBORNE CURVE CRUSH 4.2oz SPY EDT M,38.00, $18.00 
3,M- LIZ CLAIBORNE CURVE SPORT 4.2oz SPY EDC M,40.00, $20.00 
3,M- LIZ CLAIBORNE CURVE WAVE 4.2oz SPY EDT M,35.00, $15.00 
3,M- LIZ CLAIBORNE LUCKY YOU 3.4OZ SPY MEN,35.00, $15.00 
3,M- LONKOOM POSSESS 3.4oz SPY EDT M,26.00, $6.00 
3,M- MARINA DE BOURBON 3.3 SPY EDT M,35.00, $15.00 
3,M- MICAELANGELO AMORE ETERNO 3.4oz SPY EDP M,25.00, $5.00 
3,M- MICAELANGELO BELLAGIO 3.4 SPY EDT MEN,28.00, $8.00 
3,M- MICHAEL GERMAN SEXUAL 4.2oz SPY EDT M,58.00, $38.00 
3,M- MICHAEL GERMAN SEXUAL FRESH 4.2oz SPY EDT M,58.00, $38.00 
3,M- MICHAEL GERMAN SEXUAL NIGHT 4.2oz SPY EDT M,58.00, $38.00 
3,M- MICHAEL JORDAN 3.4oz SPY EDT M,35.00, $15.00 
3,M- MICHAEL JORDAN FLIGHT 3.4oz SPY EDT M,35.00, $15.00 
3,M- MICHAEL JORDAN LEGEND 3.4OZ SPY EDT M,35.00, $15.00 
3,M- MICHAEL JORDAN POWER 3.4oz SPY EDT M,35.00, $15.00 
3,M- MICHAEL KORS 3.4 SPY EDT M,68.00, $48.00 
3,M- MONT BLANC EMBLEM 3.4oz SPY MEN,50.00, $30.00 
3,M- MONT BLANC EXCEPTIONNEL 2.5oz SPY EDT M,45.00, $25.00 
3,M- MONT BLANC INDIVIDUEL 2.5 SPY EDT M,45.00, $25.00 
3,M- MONT BLANC LEGEND 3.4oz SPY MEN,50.00, $30.00 
3,M- MONT BLANC LEGEND 5.0oz SPY MEN,60.00, $40.00 
3,M- MONT BLANC LEGEND INTENSE 3.4oz SPY MEN,50.00, $30.00 
3,M- MONT BLANC LEGEND SPECIAL EDITION 3.4oz SPY MEN,50.00, $30.00 
3,M- MONT BLANC PRESENCE 2.5 SPY EDT MEN,45.00, $25.00 
3,M- MONT BLANC STARWALKER 2.5oz SPY EDT M,45.00, $25.00 
3,"M- MORE FLORE ""MORE"" 3.4oz SPY EDT M",26.00, $6.00 
3,M- MOSCHINO FOREVER SAILING 3.4oz SPY EDT MEN,48.00, $28.00 
3,M- MOSCHINO UOMO 4.2 SPY MEN,45.00, $25.00 
3,M- NARCISO RODRIGUEZ 3.4oz SPY EDT M,65.00, $45.00 
3,M- NAUTICA AQUA RUSH 3.4oz SPY EDT M,35.00, $15.00 
3,M- NAUTICA AQUA RUSH GOLD 3.4oz SPY EDT M,38.00, $18.00 
3,M- NAUTICA CLASSIC 3.4 oz SPY EDC M,35.00, $15.00 
3,M- NAUTICA VOYAGE N-83 3.4oz SPY MEN,35.00, $15.00 
3,M- NEW BRAND GOLF 3.4zo SPY EDT M,25.00, $5.00 
3,M- NEW BRAND SOLEMAR 3.4oz SPY EDT M,25.00, $5.00 
3,M- NEW BRAND ZOZ 3.4oz SPY EDT M,25.00, $5.00 
3,M- ONE MAN SHOW 3.4 SPY EDT M,30.00, $10.00 
3,M- OPEN BLACK ROGER & GALLET 3.4 SPY EDT,35.00, $15.00 
3,M- OPEN WHITE ROGER & GALLET 3.4 SPY EDT,35.00, $15.00 
3,M- ORO PURO 3.54oz SPY EDT M,28.00, $8.00 
3,M- OSCAR by OSCAR DE LA RENTA FOR MEN 3.4 SPY EDT M,38.00, $18.00 
3,M- OSCAR DE LA RENTA POUR LUI 3.0 SPY EDT M,38.00, $18.00 
3,M- PACO RABANE 1 MILLON 3.4oz SPY EDT M,75.00, $55.00 
3,M- PACO RABANE 1 MILLON COLOGNE 4.2oz SPY EDT M,68.00, $48.00 
3,"M- PACO RABANNE ""PACO"" 3.4oz SPY EDT M (CAN)",48.00, $28.00 
3,M- PACO RABANNE 6.8oz SPY EDT M,65.00, $45.00 
3,M- PACO RABANNE INVICTUS 5.1oz SPY EDT M,85.00, $65.00 
3,M- PACO RABANNE ULTRAVIOLET 3.4oz SPY EDT M,55.00, $35.00 
3,M- PACO RABANNE XS 3.4oz SPY EDT M,55.00, $35.00 
3,M- PACO RABANNE XS BE A LEGEND IGGY POP 3.4oz SPY EDT M,55.00, $35.00 
3,M- PALOMA PICASO MINOTAURE 2.5oz SPY EDT MEN,58.00, $38.00 
3,M- PARIS HILTON 3.4oz SPY EDT M,38.00, $18.00 
3,M- PARIS HILTON HEIR 3.4oz SPY EDT M,35.00, $15.00 
3,M- PARIS HILTON JUST ME 3.4oz SPY EDT M,38.00, $18.00 
3,M- PAUL SEBASTIAN 8.0oz SPY COLOGNE M,40.00, $20.00 
3,M- PAUL SEBASTIAN DESIGN 3.4 SPY EDT MEN,35.00, $15.00 
3,M- PENGUIN 3.4oz SPY EDT AM,48.00, $28.00 
3,M- PENGUIN NIGHTCAP 3.4oz SPY EDT M,45.00, $25.00 
