PAGINA,DESCRIPCION,PRECIO,
2, W- J-LO GLOW RIO 3.4oz EDT SPY,45.00, $25.00 
2, W- J-LO GLOW WILD 3.4oz SPY EDT W,38.00, $18.00 
2, W- J-LO LIVE 3.4oz SPY EDP W,38.00, $18.00 
2, W- J-LO LIVE LUXE 3.4oz SPY EDP W,38.00, $18.00 
2, W- J-LO LOVE AND GLAMOUR 2.5oz SPY EDP W,40.00, $20.00 
2, W- J-LO LOVE AND LIGHT 2.5oz SPY EDP W,48.00, $28.00 
2, W- J-LO LOVE AT FIRST GLOW 3.4oz SPY EDT W,48.00, $28.00 
2, W- J-LO MIAMI GLOW 3.4oz SPY EDT W,40.00, $20.00 
2, W- J-LO STILL 3.4oz SPY EDP W,38.00, $18.00 
2, W- J-LO SUNKISSED 3.4oz SPY EDT W,43.00, $23.00 
2, W- J. CASANOVA UTOPIE 3.4oz SPY EDP W,26.00, $6.00 
2, W- JACQUES EVARD CORSAGE 3.4oz SPY EDP W,28.00, $8.00 
2, W- JACQUES FATH FATH DE FAHTH,50.00, $30.00 
2, W- JEAN COUTURIER CORIANDRE 3.3oz SPY EDP,40.00, $20.00 
2, W- JEAN PAUL GAULTIER 3.4oz SPY EDT W,58.00, $38.00 
2, W- JEANNE ARTHES Y PSOS 3.4oz SPY W,26.00, $6.00 
2, W- JEANNE ARTHES LES LIONS ATHES 3.4os SPY EDT W,28.00, $8.00 
2, W- JENNIFER ANISTON 2.9oz SPY EDP W,45.00, $25.00 
2, W- JESSICA SIMPSON FANCY 3.4oz SPY W,40.00, $20.00 
2, W- JESSICA SIMPSON FANCY GIRL 3.4oz SPY EDP W,40.00, $20.00 
2, W- JESSICA SIMPSON I FANCY YOU 3.4oz SPY EDP W,38.00, $18.00 
2, W- JESSICA SIMPSON VINTAGE BLOOM 3.4 SPY EDP W,45.00, $25.00 
2, W- JIMMY CHOO 3.4zo SPY EDT W,55.00, $35.00 
2, W- JIMMY CHOO EXOTIC 3.4zo SPY EDT W,60.00, $40.00 
2, W- JIMMY CHOO FLASH LONDON CLUB 3.3zo SPY EDP W,55.00, $35.00 
2, W- JOHAN B. CHARMED 3.4oz SPY W,28.00, $8.00 
2, W- JOHAN B. CLASSIC PRIVILEGE 3.4OZ SPY EDP W,33.00, $13.00 
2, W- JOHAN B. MOMENT 3.4OZ SPY EDP W,33.00, $13.00 
2, W- JOHAN B. SO LOVE 3.45oz SPY W,33.00, $13.00 
2, W- JOHAN B. TATOO GIRL 3.4oz SPY W,33.00, $13.00 
2, W- JOOP! FEMME 3.4 SPY EDT W,45.00, $25.00 
2, W- JOVAN MUSK 3.0oz SPY EDT W,28.00, $8.00 
2, W- JOVAN MUSK BLACK 3.0oz SPY EDT W,28.00, $8.00 
2, W- JOVAN MUSK INTENSE OUD 3.0oz SPY EDT W,28.00, $8.00 
2, W- JOVAN MUSK SECRET AMBER 3.0oz SPY EDT W,28.00, $8.00 
2, W- JOVAN MUSK WHITE 3.25oz SPY EDT W,28.00, $8.00 
2, W- JUICY COUNTURE COUTURE COUTURE 3.4oz SPY EDP W,48.00, $28.00 
2, W- JUICY COUTURE COUTURE LA LA 3.4oz SPY EDP W,60.00, $40.00 
2, W- JUICY COUTURE VIVA LA JUICY 3.4oz SPY EDP W,58.00, $38.00 
2, W- JUICY COUTURE VIVA LA JUICY LA FLEUR 5.0oz SPY EDT W,65.00, $45.00 
2, W- JUSTIN BIEBER GIRLFRIEND 3.4oz SPY EDP GIRLS,40.00, $20.00 
2, W- JUSTIN BIEBER NEXT GIRLFRIEND 3.4oz SPY EDP GIRLS,45.00, $25.00 
2, W- JUSTIN BIEBER SOMEDAY 3.4oz SPY EDP GIRLS,40.00, $20.00 
2, W- JUSTIN BIEBER THE KEY 3.4oz SPY EDP GIRLS,40.00, $20.00 
2, W- KAREN LOW DENTELLE 3.4OZ SPY EDP W,28.00, $8.00 
2, W- KAREN LOW SIXTEEN JEANS 3.4 SPY EDT W,28.00, $8.00 
2, W- KAREN LOW STYLE 3.4oz SPY EDT W,27.00, $7.00 
2, W- KAREN LOW SUBTLE 3.4oz SPY EDP W,24.00, $4.00 
2, W- KATTY PERRY KILLER QUEEN 3.4oz SPY EDP W,38.00, $18.00 
2, W- KATTY PERRY KILLER QUEEN ROYAL REVOLUTION 3.4oz SPY EDP W,45.00, $25.00 
2, W- KATTY PERRY MEOW 3.4oz SPY EDP W,40.00, $20.00 
2, W- KATTY PERRY PURR 3.4oz SPY EDP W,38.00, $18.00 
2, W- KENNETH COLE BLACK 3.4oz SPY EDP W,45.00, $25.00 
2, W- KENNETH COLE REACTION 3.4 SPY EDP W,45.00, $25.00 
2, W- KENNETH COLE WHITE 3.4 oz SPY EDP,45.00, $25.00 
2, W- KENZO FLOWER 3.4oz SPY EDP,65.00, $45.00 
2, W- KHLOE & LAMAR UNBREAKABLE LOVE 3.4oz SPY EDT W,40.00, $20.00 
2, W- KIM KARDASHIAN 3.4oz SPY EDP W,45.00, $25.00 
2, W- KIM KARDASHIAN FLEUR FATALE 3.4oz SPY EDP W,45.00, $25.00 
2, W- KIM KARDASHIAN PURE HONEY 3.4oz SPY EDP W,45.00, $25.00 
2, W- LACOSTE EAU SENSUELLE DE LACOSTE 3.0oz SPY EDP W,55.00, $35.00 
2, W- LACOSTE LOVE OF PINK 3.0oz SPY EDT W,55.00, $35.00 
2, W- LACOSTE TOUCH OF PINK 3.4oz EDT W,50.00, $30.00 
2, W- LADY GAGA FAME 3.4oz SPY EDP W,38.00, $18.00 
2, W- LALIQUE ENCRE NOIRE 3.4oz SPY EDP W,50.00, $30.00 
2, W- LAMIS EVERY WOMAN 3.4oz SPY EDP W,25.00, $5.00 
2, W- LANCOME CONNECTION 3.4oz SPY EDP W,65.00, $45.00 
2, W- LANCOME HYPNOSE 2.5oz SPY EDP W,75.00, $55.00 
2, W- LANCOME LA VIE EST BELLE 3.4oz SPY EDT W,80.00, $60.00 
2, W- LANCOME MIRACLE 3.4oz SPY EDP W,75.00, $55.00 
2, W- LANCOME POEME 3.4oz SPY EDP W,78.00, $58.00 
2, W- LANCOME TRESOR IN LOVE 2.5oz SPY EDP W,75.00, $55.00 
2, W- LANCOME TRESOR LEAU DE PARFUM 3.4oz SPY EDP W,75.00, $55.00 
2, W- LANCOME TRESOR MIDNIGHT ROSES 2.5oz SPY EDP W,75.00, $55.00 
2, W- LANVIN ARPAGE 3.4 SPY EDP W,48.00, $28.00 
2, W- LANVIN ECLAT DARPEGE 3.4 SPY EDP W,48.00, $28.00 
2, W- LANVIN MARRY ME! 2.5oz SPY EDP W,48.00, $28.00 
2, W- LANVIN OXYGENE 2.5oz SPY EDP W,35.00, $15.00 
2, W- LAPIDUS CREATION 3.4oz SPY EDT W,35.00, $15.00 
2, W- LAPIDUS FANTASME 3.4oz SPY EDT W,35.00, $15.00 
2, W- LAURA BACI BOOK LOVE VOL II 3.4oz SPY EDP W,29.00, $9.00 
2, W- LAURA BACI CUTE BLUE 3.4oz SPY EDT W,28.00, $8.00 
2, W- LAURA BACI CUTE PINK 3.4oz SPY W,28.00, $8.00 
2, W- LEONARD TAMANGO 3.3oz SPY EDT W,40.00, $20.00 
2, W- LIZ CLAIBORNE 3.4oz SPY EDP W,35.00, $15.00 
2, W- LIZ CLAIBORNE BORA BORA 3.4oz SPY EDT W,35.00, $15.00 
2, W- LIZ CLAIBORNE CURVE 3.4oz SPY EDT W,35.00, $15.00 
2, W- LIZ CLAIBORNE CURVE CHILL 3.4oz SPY EDT W,35.00, $15.00 
2, W- LIZ CLAIBORNE CURVE CONNECT 3.4oz SPY EDT W,35.00, $15.00 
2, W- LIZ CLAIBORNE CURVE KICKS 3.4oz SPY EDT W,35.00, $15.00 
2, W- LIZ CLAIBORNE CURVE WAVE 3.4oz SPY EDT W,35.00, $15.00 
2, W- LIZ CLAIBORNE LUCKY YOU 3.4oz SPY EDT W,35.00, $15.00 
2, W- LIZ CLAIBORNE MAMBO 3.4 SPY EDT W,35.00, $15.00 
2, W- LIZ CLAIBORNE REALITIES 3.4oz SPY EDT W,35.00, $15.00 
2, W- LIZ CLAIBORNE REALITIES OLD 3.4oz SPY EDT W ORANGE,35.00, $15.00 
2, W- LIZ CLAIBORNE VIVID 3.4oz SPY EDT W,35.00, $15.00 
2," W- LOLITA LEMPICA ""SI LOLITA"" 2.7oz SPY EDP W",50.00, $30.00 
2, W- LOLITA LEMPICKA 2.7oz SPY EDT W,50.00, $30.00 
2, W- LOLITA LEMPICKA 3.4 SPY EDP W,50.00, $30.00 
2, W- LOMANI CRUISER 3.4 SPY EDT W,29.00, $9.00 
2, W- LOMANI DUE 3.4OZ SPY EDP W,29.00, $9.00 
2, W- LOMANI EXTREME RED 3.4oz SPY EDP W,25.00, $5.00 
2, W- LOMANI FEMME 3.4OZ SPY EDP W,29.00, $9.00 
2, W- LOMANI HIGH TECH SPORT 3.4oz SPY EDT W,28.00, $8.00 
2, W- LOMANI SI FLEURI PASION 3.4 SPY EDP W,28.00, $8.00 
2, W- LOVE PASSPORT 3.4oz SPY EDT W,29.00, $9.00 
2, W- LUXURIOUS by LOUISE DE MAURILLAC 3.4 SPY EDP W,29.00, $9.00 
2, W- M2 ORANGE 3.4OZ SPY EDP W,28.00, $8.00 
2, W- MADONA TRUTH OR DARE 3.4 SPY EDP W,50.00, $30.00 
2, W- MARC JACOBS DAISY DREAM 3.4oz SPY EDT W,65.00, $45.00 
2, W- MARC JACOBS DAISY EAU SO FRESH 4.2oz SPY EDT W,65.00, $45.00 
2, W- MARC JACOBS DOT HONEY 3.4oz SPY EDP W,68.00, $48.00 
2, W- MARC JACOBS LOLA 3.4oz SPY EDP W,65.00, $45.00 
2, W- MARC JACOBS OH LOLA 3.4oz SPY EDP W,68.00, $48.00 
2, W- MARCELA BORGHESE IL BACIO 3.4oz SPY EDP W,50.00, $30.00 
2, W- MARIAH CAREY FOREVER 3.4oz SPY EDP W,40.00, $20.00 
2, W- MARIAH CAREY LOLLIPOP BLING HONEY 3.3oz SPY EDP W,40.00, $20.00 
2, W- MARIAH CAREY LOLLIPOP BLING MINE AGAIN 3.3oz SPY EDP W,40.00, $20.00 
2, W- MARIAH CAREY LUSCIOUS PINK 3.3oz SPY EDP W,45.00, $25.00 
2, W- MARIAH CAREY M 3.3oz SPY EDP W,40.00, $20.00 
2, W- MARJANE WORDS 3.4 SPY EDP W,29.00, $9.00 
2, W- MELFLEURS YELUNA 3.4oz SPY EDP W,26.00, $6.00 
2, W- MICAELANGELO SIBILLA 3.4oz SPY W,26.00, $6.00 
2, W- MICHAEL KORS VERY HOLLYWOOD 3.4oz SPY EDP W,82.00, $62.00 
2, W- MONT BLANC INDIVIDUELLE 2.5 SPY EDT W,45.00, $25.00 
2, W- MONT BLANC LEGEND 2.5 SPY EDP W,50.00, $30.00 
2, W- MONT BLANC PRESENCE 2.5 SPY EDT W,48.00, $28.00 
2, W- MOSCHINO CHEAP & CHIC CHIC PETALS 3.4oz SPY EDT W,55.00, $35.00 
2, W- MOSCHINO CHEAP & CHIC 3.4oz SPY EDT W,48.00, $28.00 
2, W- MOSCHINO HIPPY FIZZ 3.4oz SPY W,48.00, $28.00 
2, W- MOSCHINO I LOVE LOVE 3.4oz SPY EDT W,48.00, $28.00 
2, W- MOSCHINO LIGHT CLOUDS 3.4oz SPY EDT W,50.00, $30.00 
2, W- MOSCHINO PINK BOUQUET 3.4oz SPY EDT W,55.00, $35.00 
2, W- MOSCHINO TOUJOURS GLAMOURS 3.4oz SPY EDT W,50.00, $30.00 
2, W- NARCISO RODRIGUEZ NARCISO 3.0oz SPY EDT W,75.00, $55.00 
2," W- NARCISO RODRIGUEZ 3.4oz SPY EDP W (Black Box, Pink Bottle)",75.00, $55.00 
2," W- NARCISO RODRIGUEZ 3.4oz SPY EDT W (Pink Box,Black Bottle)",80.00, $60.00 
2, W- NEW BRAND BE WITCHED 3.4oz SPY EDT W,25.00, $5.00 
2, W- NEW BRAND CLASSIC 3.4 SPY EDT W,25.00, $5.00 
2, W- NICKI MINAJ MINAJESTY 3.4oz SPY EDP W,45.00, $25.00 
2, W- NICKI MINAJ PINK FRIDAY 3.4oz SPY EDP W,40.00, $20.00 
2, W- NINA RICCI NINA LEAU 2.7oz SPY EAU FRAICHE W,60.00, $40.00 
2, W- NINA RICCI NINA 2.7oz SPY EDT W,58.00, $38.00 
2, W- NINA RICCI RICCI RICCI 2.7oz SPY EDP W,55.00, $35.00 
2, W- NINA RICCI LAIR DU TEMPS 3.4 SPY EDT W,55.00, $35.00 
2, W- NINA RICCI LAIR DU TEMPS LOVE FILLS 3.4oz SPY EDT W,55.00, $35.00 
2, W- NINA RICCI MADEMOISELLE RICCI 2.7oz SPY EDP W,58.00, $38.00 
2, W- NIURKA by NIURKA MARCOS 3.0oz SPY EDP With PHEROMONES,40.00, $20.00 
2, W- OMBRE ROSE 3.4oz SPY EDT W,45.00, $25.00 
2, W- OMBRE ROSE COLOGNE 3.4oz SPY EDC W,45.00, $25.00 
2, W- ONE DIRECTION OUR MOMENT 3.4oz SPY EDP W,38.00, $18.00 
2, W- ONE DIRECTION THAT MOMENT 3.4oz SPY EDP W,40.00, $20.00 
2, W- ONE DIRECTION YOU & I 3.4oz SPY EDP W,45.00, $25.00 
2, W- ONLY ME 3.4OZ SPY EDP W,28.00, $8.00 
2, W- OSCAR DE LA RENTA 8.0oz SPY EDT W,60.00, $40.00 
2, W- OSCAR DE LA RENTA INTRUSION 3.4 SPY EDT W,45.00, $25.00 
2, W- OSCAR DE LA RENTA LATIN LIGHT 3.4 SPY EDT,45.00, $25.00 
2, W- OSCAR DE LA RENTA LIMITED 3.4oz SPY EDP W,45.00, $25.00 
2, W- OSCAR DE LA RENTA ROSAMOR 3.4oz SPY EDT W,38.00, $18.00 
2, W- OSCAR DE LA RENTA SO DE LA RENTA 3.3oz SPY EDT W,40.00, $20.00 
2, W- P.D. 3.3oz SPY EDP W,28.00, $8.00 
2," W- PACO RABANNE LADY MILLON ""EAU MY GOLD"" 2.7oz SPY EDT W",65.00, $45.00 
2, W- PACO RABANNE LADY MILLON 2.7oz SPY EDP W,65.00, $45.00 
2, W- PACO RABANNE ULTRA RED 2.7oz SPY EDP W,58.00, $38.00 
2, W- PACO RABANNE XS BLACK 2.7oz SPY EDT W,60.00, $40.00 
2, W- PACO RABANNE XS LEXCES BLACK 2.7oz SPY EDT W,60.00, $40.00 
2, W- PARIS EMOTION 3.4oz SPY EDT W,28.00, $8.00 
2, W- PARIS FIRST LOVE 3.4oz SPY EDP W,28.00, $8.00 
2, W- PARIS FRENCH CAN CAN 3.4oz SPY EDP W,25.00, $5.00 
2, W- PARIS FULL METAL BLUE 3.3oz SPY W,28.00, $8.00 
2, W- PARIS FULL METAL RED 3.3oz SPY W,28.00, $8.00 
2, W- PARIS HILTON 3.4oz SPY EDP W,38.00, $18.00 
2, W- PARIS HILTON CAN CAN 3.4oz SPY EDP W,38.00, $18.00 
2, W- PARIS HILTON CAN CAN BURLESQUE 3.4oz SPY EDP W,40.00, $20.00 
2, W- PARIS HILTON DAZZLE 4.2oz SPY EDP W,40.00, $20.00 
2, W- PARIS HILTON HEIRES 3.4oz SPY EDP W,38.00, $18.00 
2, W- PARIS HILTON JUST ME 3.4oz SPY EDP W,38.00, $18.00 
2, W- PARIS HILTON PASSPORT ST. MORITZ 3.4oz SPY EDT W,30.00, $10.00 
2, W- PARIS HILTON SIREN 3.4oz SPY EDP W,38.00, $18.00 
2, W- PARIS HILTON TEASE 3.4oz SPY EDT W,35.00, $15.00 
2, W- PARIS HILTON WITH LOVE 3.4 oz SPY EDP,38.00, $18.00 
2, W- PARIS HRAIR 3.4oz SPY W,28.00, $8.00 
2, W- PARIS MISS PROMIS JURE 3.4 SPY EDP W,30.00, $10.00 
2, W- PARIS MORE EXTREMO 3.4 SPY EDP W,25.00, $5.00 
2, W- PARIS SENSATION 3.4 SPY EDP W,25.00, $5.00 
2, W- PARIS SILVER LINE 3.4OZ SPY EDP W,28.00, $8.00 
2, W- PARIS SONATE 3.4 SPY W,28.00, $8.00 
2, W- PARIS TAZAMO 3.4 SPY EDP W,27.00, $7.00 
2, W- PARIS WILD CATS 3.4 SPY EDP W,26.00, $6.00 
2, W- PAUL SEBASTIAN CASUAL 4oz SPY EDP W,35.00, $15.00 
2, W- PAUL SEBASTIAN DESIGN 3.4oz SPY EDP W,35.00, $15.00 
2, W- PERFUME GRESS CABOCHARD 3.4oz SPY EDT W,35.00, $15.00 
2, W- PERFUME GRESS CABOTINE 3.4oz SPY EDT W,35.00, $15.00 
2, W- PERRY ELLIS 3.4oz SPY EDP W NEW!!,38.00, $18.00 
2, W- PERRY ELLIS 360* 3.4oz SPY EDT W,42.00, $22.00 
2, W- PERRY ELLIS 360* PINK 3.4oz SPY EDP W,38.00, $18.00 
2, W- PERRY ELLIS 360* PURPLE 3.4oz SPY EDP W,45.00, $25.00 
2, W- PERRY ELLIS 360* RED 3.4oz SPY EDP W,38.00, $18.00 
2, W- PERRY ELLIS 360* WHITE 3.4oz SPY EDP W,38.00, $18.00 
2, W- PERRY ELLIS AMERICA 5.0oz SPY EDT W,38.00, $18.00 
2, W- PERRY ELLIS HER 4.2oz SPY EDP W,38.00, $18.00 
2, W- PERRY ELLIS RESERVE 3.4oz SPY EDP W,38.00, $18.00 
2, W- PHANTOM 3.4oz SPY EDP W,35.00, $15.00 
2, W- PINK FLOWERS 3.4oz SPY W,28.00, $8.00 
2, W- PINK SUGAR 3.4oz SPY EDT W,40.00, $20.00 
2, W- PINK SUGAR GOLD 3.4oz SPY EDT W,40.00, $20.00 
2, W- PLAYBOY 2.5oz SPY EDT W,27.00, $7.00 
2, W- PRADA MILANO INFUSION DIRIS 3.4oz SPY EDT W,70.00, $50.00 
2, W- PRADA MILANO INFUSION DIRIS 6.6oz SPY EDT W,80.00, $60.00 
2, W- RALPH LAUREN RALPH 3.4oz SPY W,65.00, $45.00 
2, W- RALPH LAUREN POLO SPORT 5.1 SPY EDT W,75.00, $55.00 
2, W- RALPH LAUREN ROMANCE 3.4oz SPY EDP W,75.00, $55.00 
2, W- RALPH LAUREN ROMANCE MIDNIGHT 3.4oz SPY EDP W,75.00, $55.00 
2, W- RALPH LAUREN SAFARI 2.5oz SPY EDP W,78.00, $58.00 
2, W- REMY LATOUR INTENSE 3.4oz SPY EDP W,30.00, $10.00 
2, W- REMY LATOUR RL 3.4 SPY WOMEN,28.00, $8.00 
2, W- REMY LATOUR RL INTENSE 3.4oz SPY EDT W,28.00, $8.00 
2, W- REMY LATOUR SI TENDRE DAMOR 3.4 SPY EDP W,28.00, $8.00 
2, W- REVLON CHARLIE 3.4zo SPY EDT W,28.00, $8.00 
2, W- REVLON CIARA 2.0oz SPY EDT W,28.00, $8.00 
2, W- ROCHAS ABSOLU 2.5 SPY EDP W,45.00, $25.00 
2, W- ROCHAS FEMME 3.4 SPY EDT W,45.00, $25.00 
2, W- ROCHAS MADAME 3.4oz SPY EDT W,45.00, $25.00 
2, W- ROYAL SECRET EAU 3.4 SPY EDT W,40.00, $20.00 
2, W- RUMBA by TED LAPIDUS 3.4oz SPY EDT W,35.00, $15.00 
2, W- SALVADOR DALI DALI STYLE 3.4oz SPY EDT W,40.00, $20.00 
2, W- SALVADOR DALI LITTLE KISS 3.4oz SPY EDP W,40.00, $20.00 
2, W- SALVADORE FERRAGAMO INCANTO 3.4oz SPY EDP W,45.00, $25.00 
2, W- SALVADORE FERRAGAMO INCANTO AMITY 3.4oz SPY EDT W,45.00, $25.00 
2, W- SALVADORE FERRAGAMO INCANTO BLOOM 3.4oz SPY EDP W,45.00, $25.00 
2, W- SALVADORE FERRAGAMO INCANTO CHARMS 3.4oz SPY EDT W,45.00, $25.00 
2, W- SALVADORE FERRAGAMO INCANTO DREAM GOLDEN 3.4oz SPY EDP W,45.00, $25.00 
2, W- SALVADORE FERRAGAMO INCANTO DREAMS 3.4oz SPY EDT W,45.00, $25.00 
2, W- SALVADORE FERRAGAMO INCANTO HEAVEN 3.4oz SPY EDT W,45.00, $25.00 
2, W- SALVADORE FERRAGAMO INCANTO SHINE 3.4 SPY EDT W,45.00, $25.00 
2, W- SALVATORE FERRAGAMO SIGNORINA 3.4 SPY EDP W,58.00, $38.00 
2, W- SARA JESSICA PARKER LOVELY 3.4oz SPY EDP W,48.00, $28.00 
2, W- SEAN JOHNN UNFORGIVABLE 4.2oz SPY EDP W,55.00, $35.00 
2, W- SELENA GOMEZ 3.4oz SPY EDP W,40.00, $20.00 
2, W- SENSIBILITY 3.3oz SPY EDP W,28.00, $8.00 
2, W- SEX IN THE CITY 3.4oz SPY EDP W,22.50, $2.50 
2, W- SIRENE VICKY TIEL 3.4 SPY EDP W,38.00, $18.00 
2, W- SNOOKI COUTURE 3.4oz SPY EDP W,40.00, $20.00 
2, W- SWAROVSKI AURA 2.6oz SPY EDT W,48.00, $28.00 
2, W- SWISS ARMY MOUNTAIN WATER 3.4oz SPY EDT W,40.00, $20.00 
2, W- TEA ROSE by WORKSHOP 4.0oz SPY EDT W,28.00, $8.00 
2, W- THIERRY MUGLER ANGEL 3.4oz SPY EDP W (REFILLABLE),88.00, $68.00 
2, W- TOMMY EAU DE PREP 3.4oz SPY EDT W,48.00, $28.00 
2, W- TOMMY GIRL 3.4oz SPY EDT W,45.00, $25.00 
2, W- TOMMY GIRL SUMMER 3.4oz SPY EDP W,55.00, $35.00 
2, W- TOUS IN HEAVEN 3.4oz SPY W,45.00, $25.00 
2, W- TOUS LEAU DE by TOUS 3.0oz SPY EDT W,50.00, $30.00 
2, W- TOUS ROSA 3.0oz SPY EDP W,50.00, $30.00 
2, W- TOUS TOUCH 3.4oz SPY EDT W,50.00, $30.00 
2, W- TRUE RELIGION 3.4oz SPY EDP W,45.00, $25.00 
2, W- TRUE RELIGION LOVE HOPE DEMIN 3.4oz SPY EDP W,48.00, $28.00 
2, W- TUTTIFIORI CITY X 3.4oz SPY EDP W,28.00, $8.00 
2, W- VALENTINO VALENTINA ACQUA FLOREALE 2.7oz SPY EDT W,58.00, $38.00 
2, W- VAN CLEEF FIRST 3.4oz SPY EDT W,50.00, $30.00 
2," W- VANDERBILT ""GLORIA VANDERBILT"" 3.4oz SPY W",30.00, $10.00 
2, W- VERA WANG 3.4oz SPY EDP W,48.00, $28.00 
2, W- VERA WANG ANNIVERSARY 3.4oz SPY EDP W,55.00, $35.00 
2, W- VERA WANG LOOK 3.4oz SPY EDP W,45.00, $25.00 
2, W- VERA WANG LOVESTRUCK FLORAL RUSH 3.4oz SPY EDP W,45.00, $25.00 
2, W- VERA WANG PREPPY PRINCESS 3.4oz SPY EDT W,45.00, $25.00 
2, W- VERA WANG PRINCES FLOWER 3.4oz SPY EDP W,55.00, $35.00 
2, W- VERA WANG PRINCES ROCK 3.4oz SPY EDP W,45.00, $25.00 
2, W- VERA WANG PRINCESS GLAM 3.4oz SPY EDP W,45.00, $25.00 
2, W- VERA WANG SHEER VIEL 3.4oz SPY EDP W,50.00, $30.00 
2, W- VERSACE BRIGHT CRYSTAL 3.0OZ SPY W,58.00, $38.00 
2, W- VERSACE CRYSTAL NOIR 3.0oz SPY EDT W,60.00, $40.00 
2, W- VERSACE POUR FEMME 3.4oz SPY EDP W,58.00, $38.00 
2, W- VERSACE RED JEANS 2.5oz SPY EDT W,38.00, $18.00 
2, W- VERSACE VANITAS 3.4oz SPY EDT W,58.00, $38.00 
2, W- VERSACE WOMAN by VERSACE 3.4oz SPY EDP W,55.00, $35.00 
2, W- VERSACE YELLOW DIAMOND 3.0oz SPY EDT W,58.00, $38.00 
2, W- VERSACE YELLOW DIAMOND INTENSE 3.0oz SPY EDP W,60.00, $40.00 
2, W- VICKY TIEL by TICKLED PINK 3.4oz EDP W,35.00, $15.00 
2, W- VIKTOR & ROLF FLOWERBOMB 3.4oz SPY EDT W,110.00, $90.00 
2, W- VINCE CAMUTO FIORI 3.4oz SPY EDT W,55.00, $35.00 
2, W- VIVIANE VENDELE INFONIE GREEN 3.4oz SPY EDT W,29.00, $9.00 
2, W- VIVIANE VENDELE SO INDEFINIE 3.4 SPY EDT W,28.00, $8.00 
2, W- WHITE SHOULDERS 4.5 SPY EDP W,38.00, $18.00 
2, W- XENIM FANTASY 3.4oz SPY EDP W,25.00, $5.00 
2, W- YSL OPIUM 3.0oz SPY EDT W,75.00, $55.00 
2, W- YSL PARIS 4.2oz SPY EDT W,75.00, $55.00 
2, W- YSL SAHARIENNE 4.2oz SPY EDT W,65.00, $45.00 
2, W- YVES DE SISTELLE AKOYA 3.4 SPY EDT W,28.00, $8.00 
2, W- YVES DE SISTELLE INCIDENCE 3.4oz SPY EDP W,28.00, $8.00 
2, W- YVES DE SISTELLE TENDER KISS 3.3oz SPY EDP W,29.00, $9.00 
2, W-GIORGIO AIRE 3.0oz SPY EDT W,35.00, $15.00 
2, W-GIORGIO BLUE 3.0oz SPY EDT W,35.00, $15.00 
2, W-SET ADRIENNE VITTADINI AV (3pcs) 3.0oz SPY EDP + 3.3oz BODY LOTION + 3.3oz SHOWER GEL W,50.00, $25.00 
2," W-SET ALFRED SUNG ""SUNG"" (3pcs) 3.4oz SPY EDT + 2.5oz BODY LOTION + 2.5oz SHOWER GEL W",50.00, $25.00 
2, W-SET ALFRED SUNG SHI (3pcs) 3.4oz SPY EDP+2.5oz B.L+.24oz EDP W,50.00, $25.00 
2, W-SET BEBE DESIRE (3pcs) 3.4oz SPY EDP+3.4oz B.L+3.4oz S.G W,50.00, $25.00 
2, W-SET BEBE GLAM (3pcs) 3.4oz SPY EDP+3.4oz B.L+3.4oz S.G W,50.00, $25.00 
2, W-SET BEBE GOLD (4pcs) 3.4oz SPY EDP+2.5oz B.L+2.5oz S.G +CHARM W,50.00, $25.00 
2, W-SET BEBE NOUVEAU (3pcs) 3.4oz SPY EDP+3.4oz B.L+3.4oz S.G W,50.00, $25.00 
2, W-SET BEBE SHEER 3.4oz SPY EDP W,50.00, $25.00 
2, W-SET BEBE WISHES AND DREAMS (3pcs) 3.4oz SPY EDP+3.4oz B.L+3.4oz S.G W,50.00, $25.00 
2, W-SET BETSY JHONSON (2pcs) 3.4oz SPY EDP 6.7oz B.LW,53.00, $28.00 
2, W-SET BETTY BOOP (4pcs) 2.55oz SPY EDP + 3.4oz BUBBLE BATH + 3.4oz BODY LOTION AND HAND BAG GIRLS,40.00, $15.00 
2, W-SET BILL BLASS BASIC BLACK (3pcs) 3.4oz SPY EDP+6.8oz B.L. +6.8oz HAND CREAM W,43.00, $18.00 
2, W-SET BRITNEY SPEARS FANTASY (3pcs) 3.3oz SPY EDP+3.4oz BODY LOTION+3.4oz SHOWER GEL,55.00, $30.00 
2, W-SET BURBERRY BODY TENDER (3pcs) 2.8oz SPY EDT + 3.3oz B.L+ 3.3oz S.G W,65.00, $40.00 
2, W-SET BURBERRY BRIT (3pcs) 3.3oz SPY EDP+ (2 * 0.25oz SPY EDP),73.00, $48.00 
2, W-SET BURBERRY BRIT SHEER (3pcs) 3.3oz SPY EDT + 0.15oz SPY EDT + COSMETICS POUCH W,65.00, $40.00 
2, W-SET CABOTINE (3pcs) 3.4oz SPY EDT+6.8oz B.L+6.8oz S.G W,45.00, $20.00 
2, W-SET CACHAREL LIBERTE (2pcs) 1.7oz SPY EDP + 3.4oz BODY LOTION W,60.00, $35.00 
2, W-SET CALVIN KLEIN CK ONE SCHOCK (2pcs) 6.7oz SPY EDT + 3.4oz BODY LOTION W,60.00, $35.00 
2, W-SET CALVIN KLEIN ESCAPE 3.4oz SPY EDP + 6.7oz BODY LOTION (2pcs TRAVEL BOX) W,55.00, $30.00 
2, W-SET CALVIN KLEIN ETERNITY 3.4oz SPY EDP -6.7 BL- MINI W (3pcs),60.00, $35.00 
2, W-SET CALVIN KLEIN ETERNITY AQUA (3pcs ) 3.4oz SPY EDP + 6.7oz B.L. + 10ml ROLLER PERFUME W,60.00, $35.00 
2, W-SET CALVIN KLEIN EUPHORIA (3pcs) 3.4oz SPY EDP+6.7oz B.L+.05oz EDP SPY W,73.00, $48.00 
2, W-SET CALVIN KLEIN EUPHORIA ENDLESS (3pcs) 4.2oz SPY EDP + 3.4oz B.L+0.5oz SPY EDP W,60.00, $35.00 
2, W-SET CALVIN KLEIN OBSESSION (4pcs) 3.4oz SPY EDP+.05oz SPY EDP+3.4oz S.G+6.8oz B.L W,60.00, $35.00 
2, W-SET CAROLINA HERRERA CH SUBLIME (2pcs) 2.7oz SPY EDT+6.7oz B.L.,80.00, $55.00 
2, W-SET CAROLINA HERRERA 212 (2pcs) 3.4oz SPY EDT + 3.4oz B.L W,80.00, $55.00 
2, W-SET CAROLINA HERRERA 212 SEXY (2pcs) 3.4oz SPY EDT + 6.7oz B.L W,80.00, $55.00 
2, W-SET CUBA (4pcs) 4 PERFUME BOTTLE 1.17ozSPY W,33.00, $8.00 
2, W-SET DAVIDOFF COOL WATER (3pcs) 3.4 SPY EDT +2.5oz BODY LOTION + 2.5oz SHOWER GEL W,53.00, $28.00 
2, W-SET DELICIOUS GALE HAYMANS BEVELRY HILLS (3pcs) 3.4oz SPY EDT+ 3.3oz BODY LOTION + 3.3oz SHOWER GEL W,43.00, $18.00 
2, W-SET DOLCE & GABBANA DOLCE (3pcs) 2.5oz SPY EDP+ 3.3oz B.L+ 3.3oz S.G W,80.00, $55.00 
2, W-SET DOLCE & GABBANA FEMME (3pcs) 3.4oz SPY EDP+3.4oz S.G+3.4oz B.L W,80.00, $55.00 
2, W-SET DOLCE & GABBANA THE ONE (3pcs) 2.5oz SPY EDP +3.4oz B.L+0.25oz EDP,80.00, $55.00 
2," W-SET ELIZABETH ARDEN ARDEN BEAUTY"" (2pcs) 3.3oz SPY EDP + 3.3oz BODY LOTION W",45.00, $20.00 
2, W-SET ELIZABETH ARDEN 5th AVENUE (3pcs) 4.2oz SPY EDP + 0.12oz SPL EDP + 3.3oz BODY LOTION W,53.00, $28.00 
2, W-SET ELIZABETH ARDEN GREEN TEA (4pcs) 3.3oz SPY EDT + 3.3oz BODY LOTION + 3.3oz SHOWER GEL +0.12oz EDP W,45.00, $20.00 
2, W-SET ELIZABETH ARDEN PROVOCATIVE (2pcs) 3.3oz SPY EDP + 3.3oz BODY LOTION W,50.00, $25.00 
2, W-SET ELIZABETH TAYLOR DIAMONDS & EMERALDS (2pcs) 3.4oz SPY EDT + 3.3oz BODY LOTION W,40.00, $15.00 
2, W-SET ELIZABETH TAYLOR DIAMONDS & RUBIES (2pcs) 3.4oz SPY EDT + 3.3oz BODY LOTION W,40.00, $15.00 
2, W-SET ELIZABETH TAYLOR DIAMONDS & SAPPHIRES (2pcs) 3.4oz SPY EDT + 3.3oz BODY LOTION W,40.00, $15.00 
2, W-SET ELIZABETH TAYLOR PASSION (3pcs) 2.5oz SPY DEP + .12oz SPL EDP + 6.8oz PERFUMED BODY LOTION W,45.00, $20.00 
2, W-SET ELIZABETH TAYLOR WHITE DIAMOND LUSTRE (3pcs) 3.3oz SPY EDT + .3.3oz MINIS SPY EDP + 3.3 oz BC + 3.3oz BW HARD BOX,50.00, $25.00 
2, W-SET EXCLAMATION (2pcs) 1.7oz SPY EDT +15ml EDP W,35.00, $10.00 
2, W-SET GIORGIO ARMANI SI 3.4oz SPY EDP+2.5oz B.L W,100.00, $75.00 
2, W-SET GIORGIO BEVERLY HILLS GIORGIO RED (2pcs) 3.0oz SPY EDT + 6.8oz BODY LOTION W,50.00, $25.00 
2, W-SET GIVENCHY DAHLIA NOIR (3pcs) 2.5oz SPY EDT+2.5oz B.L.+2.5oz S.G,70.00, $45.00 
2, W-SET GIVENCHY EXTRAVAGANCE ICE CREAM (2pcs) 3.3oz SPY EDP + 3.3oz SPY BODY LOTION W,50.00, $25.00 
2, W-SET GIVENCHY ORGANZA (3pcs) 3.3oz SPY EDP+2.5oz BODY LOTION+2.5oz SHOWER GEL W,75.00, $50.00 
2, W-SET HALLOWEEN by JESUS DEL POZO (4pcs) 3.4oz SPY EDT + 3.4oz BODY LOTION + 3.4oz SHOWER GEL+ 0.15oz SPL EDT W,55.00, $30.00 
2, W-SET HARAJUKU LIL ANGEL 1.0oz SPY EDT+ SOLID PERFUME COMPACT W (YELLOW),40.00, $15.00 
2, W-SET HARAJUKU MUSIC 1.0oz SPY EDT+ SOLID PERFUME COMPACT W (BLUE),40.00, $15.00 
2, W-SET J-LO GLOW (2pcs) 3.4oz SPY EDT + 6.8oz BODY LOTION W,53.00, $28.00 
2, W-SET JEAN PAUL GAULTIER (3pcs) 3.3oz SPY EDT+2.5oz B.L+1.0oz SG W,70.00, $45.00 
2, W-SET JESSICA SIMPSON FANCY (4pcs) 3.4oz SPY EDP + 0.34oz SPY EDP + 3.0oz BODY LOTION + 3.0oz SHOWER GEL W,50.00, $25.00 
2, W-SET JESSICA SIMPSON FANCY NIGHTS (3pcs) 3.4oz SPY EDP + .25oz SPL EDP + 3.0oz BODY LOTION W,43.00, $18.00 
2, W-SET JESUS DEL POZO ON (3pcs) 3.4oz SPY EDT + 3.4oz BODY LOTION + 3.4oz SHOWER GEL W,50.00, $25.00 
2, W-SET JIMMY CHOO FLASH (3pcs) 3.4zo SPY EDP+3.4oz BODY LOTION+3.4oz S/G W,65.00, $40.00 
2, W-SET JUICY COUTURE (3pcs) 3.4oz SPY EDT+4.2oz B.L+4.2oz S.G .33oz SPY W,73.00, $48.00 
2, W-SET JUICY COUTURE PEACE LOVE (3pcs) 3.4oz SPY EDP+4.2oz B.L.+4.2oz S.G W,60.00, $35.00 
2, W-SET JUICY COUTURE VIVA LA FLEUR (3pcs) 5.0oz SPY EDT+0.33oz PEN SPY +.017 EDT SPL,63.00, $38.00 
2, W-SET JUSTIN BIEBER GIRLFRIEND (3pcs) 3.4oz SPY EDP+3.4oz B.L.+3.4oz S.G. W,50.00, $25.00 
2, W-SET KATTY PERRY KILLER QUEEN (4pcs) 3.4oz SPY EDP+ 0.34oz ROLLERBALL EDP +2.5oz BODY LOTION + 2.5oz SHOWER GEL W,50.00, $25.00 
2, W-SET KENZO FLOWER (3pcs) 3.4oz SPY EDP+1.7oz SG + 1.7oz B.L W,75.00, $50.00 
2, W-SET KENZO FLOWER TAG (3pcs) 3.4oz SPY EDP+1.7oz B.L+POUCH,75.00, $50.00 
2, W-SET LACOSTE TOUCH OF PINK (2pcs) 3.0oz SPY EDT + 5.0oz BODY LOTION W,60.00, $35.00 
2, W-SET LANVIN RUMEUR (3pcs) 3.3oz SPY EDP + 3.3oz SHOWER GEL + 3.3oz BODY LOTION W,60.00, $35.00 
2," W-SET LIZ CLAIBORNE ""LIZ SPORT"" (3pcs) 3.4oz SPY EDT 3.4oz B.L+3.4oz S.G W",45.00, $20.00 
2, W-SET LIZ CLAIBORNE MAMBO (3pcs) 3.4oz SPY EDP + 3.4oz BODY LOTION + 3.4oz SHOWER GEL W,45.00, $20.00 
2, W-SET MARC JACOBS DAISY DREAM 3.4oz SPY EDT+5.1oz B.L W,80.00, $55.00 
2, W-SET MARIAH CAREY FOREVER (2pcs) 3.3oz SPY EDP + 6.8oz BODY LOTION W,50.00, $25.00 
2, W-SET MARIAH CAREY LUSCIOUS PINK (2pcs) 3.3oz SPY EDP+ 6.7oz B.L W,50.00, $25.00 
2, W-SET MICAELANGELO ATLANTIDE (3pcs) 3.3oz SPY EDP + 5.0oz BODY LOTION + 5.0oz SHOWER GEL W,40.00, $15.00 
2, W-SET MONT BLANC FEMME (3pcs) 2.5oz SPY EDT + 3.3oz BODY LOTION + 3.3oz SHOWER GEL W,63.00, $38.00 
2, W-SET MONT BLANC PRESENCE (3pcs) 2.5oz SPY EDT + 3.3oz BODY LOTION + 3.3oz SHOWER GEL W,63.00, $38.00 
2, W-SET MOSCHINO CHEAP & CHIC (3pcs) 1.7oz SPY EDP +3.4oz BODY LOTION + 3.4oz SHOWER GEL W,50.00, $25.00 
2," W-SET NICOLE RICHIE ""NICOLE"" (4pcs) 3.4oz SPY EDP + 0.34oz ROLL-ON EDP + 3.4oz BODY LOTION + 3.4oz SHOWER GEL W",43.00, $18.00 
2," W-SET ORO by PAULINA RUBIO 2pcs (W) 3.4 EDP SPY + 6.7 BODY LOTION, ORGANZA COVERED, GOLD METAL GIFT BOX",50.00, $25.00 
2, W-SET OSCAR DE LA RENTA (3pcs) 3.3oz SPY EDT+3.4oz BODY LOTION + 3.4oz BODY WASH W (HARD BOX),60.00, $35.00 
2, W-SET OSCAR DE LA RENTA SO DE LA RENTA (2pcs) 3.4oz SPY EDT+6.7oz B.L W,50.00, $25.00 
2, W-SET OSCAR DE LA RENTA VOLUPTE (2pcs) 3.4oz SPY EDT+6.7oz B.L W,50.00, $25.00 
2, W-SET PACO RABANNE ULTRAVIOLET (2pcs) 2.7oz SPY EDP + 3.4oz BODY LOTION W,65.00, $40.00 
2, W-SET PALOMA PICASSO (2pcs) 1.7oz SPY EDP + 6.7oz BODY LOTION W,60.00, $35.00 
2, W-SET PARIS HILTON (4pcs) 3.4oz SPY EDP + 0.34oz SPY EDP +3.0oz BODY LOTION + 3.0oz SHOWER GEL W,50.00, $25.00 
2, W-SET PARIS HILTON CAN CAN (4pcs) 3.4oz SPY EDP+3.0B/L+3.0S/G+ COIN PURSE W,50.00, $25.00 
2, W-SET PARIS HILTON CAN CAN BURLESQUE (4pcs) 3.4oz SPY EDT+3.0B/L+3.0S/G+ COIN PURSE W,50.00, $25.00 
2, W-SET PARIS HILTON HEIRESS (4pcs) 3.4oz SPY EDP + 0.34oz SPY EDP+ 3.0oz BODY LOTION + 3.0oz SHOWER GEL W,50.00, $25.00 
2, W-SET PARIS HILTON WITH LOVE (4pcs) 3.4oz SPY EDP + 0.2oz SPY EDP +3.0oz BODY LOTION + 3.0oz SHOWER GEL W,50.00, $25.00 
2, W-SET PAUL SEBASTIAN DESING (2pcs) 3.4oz SPY EDP + 6.8oz BODY LOTION W,45.00, $20.00 
