PAGINA,DESCRIPCION,PRECIO,
3,M- PENGUIN RESERVE 3.4 spy EDT MEN,48.00, $28.00 
3,M- PENGUIN ROCKS 3.4 spy EDT MEN,45.00, $25.00 
3,M- PERRY ELLIS 18 3.4oz SPY EDT M,40.00, $20.00 
3,M- PERRY ELLIS 18 INTENSE 3.4oz SPY EDT M,38.00, $18.00 
3,M- PERRY ELLIS 360 GREEN 3.4oz SPY EDT M,40.00, $20.00 
3,M- PERRY ELLIS 360 3.4oz SPY EDT M,38.00, $18.00 
3,M- PERRY ELLIS 360 6.8oz SPY EDT M,45.00, $25.00 
3,M- PERRY ELLIS 360 BLACK 3.4oz SPY EDT M,38.00, $18.00 
3,M- PERRY ELLIS 360 RED 3.4oz SPY EDT M,38.00, $18.00 
3,M- PERRY ELLIS 360 WHITE 3.4oz SPY EDT M,38.00, $18.00 
3,M- PERRY ELLIS AMERICA 5.0oz SPY EDT M,40.00, $20.00 
3,M- PERRY ELLIS AQUA 3.4 SPY EDT MEN,40.00, $20.00 
3,M- PERRY ELLIS CITRON 3.4oz SPY EDT M,45.00, $25.00 
3,M- PERRY ELLIS COBALT 3.4oz SPY EDT M,45.00, $25.00 
3,M- PERRY ELLIS HIM 3.4oz SPY EDT M,38.00, $18.00 
3,M- PERRY ELLIS M 3.4oz SPY EDT M,38.00, $18.00 
3,M- PERRY ELLIS MAN 3.4oz SPY EDT M,38.00, $18.00 
3,M- PERRY ELLIS NIGHT 3.4oz SPY EDT M,38.00, $18.00 
3,M- PERRY ELLIS PLATINUM LABEL 3.4oz SPY EDT M,38.00, $18.00 
3,M- PERRY ELLIS PORTFOLIO 3.4oz SPY MEN,38.00, $18.00 
3,M- PERRY ELLIS PORTFOLIO BLACK 3.4oz SPY MEN,38.00, $18.00 
3,M- PERRY ELLIS PORTFOLIO ELITE 3.4oz SPY EDT M,38.00, $18.00 
3,M- PERRY ELLIS PORTFOLIO GREEN by PERRY ELLIS 3.4oz SPY EDT M,38.00, $18.00 
3,M- PERRY ELLIS PORTFOLIO RED 3.4oz SPY EDT M,38.00, $18.00 
3,M- PHANTOM 3.4OZ SPY M,35.00, $15.00 
3,M- PIERRE CARDIN 2.8 SPY M,32.00, $12.00 
3,M- PINO SILVESTRE 4.2oz SPY EDT M,32.00, $12.00 
3,M- PLAYBOY 3.4oz SPY EDT M,28.00, $8.00 
3,M- POWER by 50 CENTA 3.4oz SPY EDT M,38.00, $18.00 
3,M- PRADA AMBER 3.4oz SPY MEN,68.00, $48.00 
3,M- QUORUM AQUA by ANTONY PUIG 3.4oz SPY EDT,30.00, $10.00 
3,M- QUORUM by ANTONY PUIG 3.4oz SPY EDT M,30.00, $10.00 
3,M- RALPH LAUREN POLO #1 BIG PONY 4.2oz SPY EDT M,65.00, $45.00 
3,M- RALPH LAUREN POLO #3 BIG PONY 4.2oz SPY EDT M,65.00, $45.00 
3,M- RALPH LAUREN POLO 4.2oz SPY EDT M,68.00, $48.00 
3,M- RALPH LAUREN POLO BLACK 4.2oz SPY EDT M,65.00, $45.00 
3,M- RALPH LAUREN POLO BLACK 6.7oz SPY EDT M,80.00, $60.00 
3,M- RALPH LAUREN POLO BLUE 4.2oz SPY EDT M,68.00, $48.00 
3,M- RALPH LAUREN POLO BLUE 6.7oz SPY EDT M,80.00, $60.00 
3,M- RALPH LAUREN POLO RED 6.7oz SPY EDT M,85.00, $65.00 
3,M- RALPH LAUREN POLO RED INTENSE 4.2oz SPY EDT M,68.00, $48.00 
3,M- RALPH LAUREN POLO SPORT 4.2 SPY EDT MEN,68.00, $48.00 
3,M- RALPH LAUREN SAFARI 4.2oz SPY EDT MEN,78.00, $58.00 
3,M- REALM 3.4oz SPY EDC M (With PHEROMONES),35.00, $15.00 
3,M- REALM INNER 3.4oz SPY EDT M,35.00, $15.00 
3,M- REMY LATOUR RL HOMME 3.4 M,28.00, $8.00 
3,M- ROCAWEAR IX 3.4oz SPY EDT M,40.00, $20.00 
3,M- ROCHAS GLOBE 3.4OZ SPY MEN,45.00, $25.00 
3,M- ROCHAS MOUSTACHE 3.4oz SPY EDT M,50.00, $30.00 
3,M- ROMA LAURA BIAGIOTTI 4.2oz SPY EDT M,50.00, $30.00 
3,M- ROYAL COPENHAGEN MUSCK3.4 Y COL,35.00, $15.00 
3,M- SALVADOR DALI AGUA VERDE 3.4 SPY EDT M,40.00, $20.00 
3,M- SALVADORE FERRAGAMO F 3.4oz SPY EDT MEN,45.00, $25.00 
3,M- SALVADORE FERRAGAMO F BLACK 3.3oz SPY EDT M,45.00, $25.00 
3,M- SALVADORE FERRAGAMO SUBTIL 3.4OZ SPY M,45.00, $25.00 
3,M- SALVATORE FERRAGAMO 3.4 SPY MEN,40.00, $20.00 
3,M- SAMBA FRENCH KISS 3.4OS SPY MEN,28.00, $8.00 
3,M- SAMBA HEAT 3.4ozSPY EDT M,28.00, $8.00 
3,M- SAMBA KISS 3.4 SPY EDT MEN,28.00, $8.00 
3,M- SAMBA ROCK & ROLL 3.4OZ SPY MEN,28.00, $8.00 
3,M- SAMBA VIVA 3.4oz SPY EDT M,28.00, $8.00 
3,M- SARAH B. 100% 3.4oz SPY EDT M,28.00, $8.00 
3,M- SEAN JHONN I AM KING 3.4oz SPY EDT M,55.00, $35.00 
3,M- SET CALVIN KLEIN REVEAL (3pcs) 3.4oz SPY EDT+3.4oz A.F+3.4oz B.W M,50.00, $30.00 
3,M- SEX IN THE CITY 3.4oz SPY EDT M,22.50, $2.50 
3,M- SWISS ARMY 3.4 SPY EDT M,40.00, $20.00 
3,M- SWISS ARMY ALTITUD 3.4 SPY EDT M,40.00, $20.00 
3,M- SWISS ARMY SPORT 3.4oz SPY EDT M,40.00, $20.00 
3,M- TABAC 3.4oz EDC SPLASH M,35.00, $15.00 
3,M- THE BARON 4.5oz SOY EDC MEN,55.00, $35.00 
3,M- THIERRY MUGLER ANGEL 3.4 SPY MEN,58.00, $38.00 
3,M- THIERRY MUGLER MUGLER COLOGNE 3.4oz SPY EDT M,65.00, $45.00 
3,M- TOMMY 3.4OZ SPY EDT MEN,40.00, $20.00 
3,M- TOMMY BAHAMAS MARTINIQUE 3.4 SPY MEN,38.00, $18.00 
3,M- TOUS 3.4oz SPY EDT M,50.00, $30.00 
3,M- TOUS IN HEAVEN 3.4oz SPY EDT M,45.00, $25.00 
3,M- TOUS SPORT 3.4oz SPY EDT M,45.00, $25.00 
3,M- TOXIC 3.4oz SPY EDT M,28.00, $8.00 
3,M- ULYSSE by VICKY TIEL 3.4oz SPY EDT M,35.00, $15.00 
3,M- VAN CLEEF & ARPELS MIDNIGHT IN PARIS 4.2oz SPY EDT M,45.00, $25.00 
3,M- VAN CLEEF & ARPELS POUR HOMME 3.4oz SPY EDT M,45.00, $25.00 
3,M- VAN CLEEF TSAR 3.4oz SPY EDT M,45.00, $25.00 
3,M- VERSACE BLUE JEANS 2.5oz SPY EDT M,35.00, $15.00 
3,M- VERSACE DREAMER 3.4oz SPY EDT M,48.00, $28.00 
3,M- VERSACE EAU FRAICHE 3.4oz SPY EDT M,55.00, $35.00 
3,M- VERSACE LHOMME SPY EDT 3.3oz M (BROWN ),48.00, $28.00 
3,M- VERSACE MAN 3.4oz SPY EDT M,55.00, $35.00 
3,M- VERSACE POUR HOMME 3.4oz SPY EDT M,55.00, $35.00 
3,M- VICTOR & ROLF SPICEBOMB 3.0oz SPY EDT M,75.00, $55.00 
3,M- VICTORY PRESTIGE 3.4oz SPY EDT M,30.00, $10.00 
3,M- YACHTMAN GREEN 3.4oz SPY EDT M,26.00, $6.00 
3,M- YSL KOUROS 3.4 SPY EDT M,58.00, $38.00 
3,M- YSL KOUROS BODY 3.4 SPY EDT M,55.00, $35.00 
3,M- YSL KOUROS SILVER 3.4oz SPY EDT M,58.00, $38.00 
3,M- YSL LHOMME 3.3oz SPY EDT M,65.00, $45.00 
3,M- YSL LHOMME INTENSE 3.3oz SPY EDT M,70.00, $50.00 
3,M- YSL LHOMME LIBRE 3.3oz SPY EDT M,65.00, $45.00 
3,M- YSL LHOMME SPORT 3.3oz SPY EDT M,65.00, $45.00 
3,M- YSL LA NUIT DE LHOMME 3.3oz SPY EDT M,65.00, $45.00 
3,M- YSL OPIUM 3.4 SPY EDT MEN,75.00, $55.00 
3,M- ZEGNA Z 3.4oz SPY EDT M,50.00, $30.00 
3,M- ZEGNA FORTE 3.4oz SPY MEN,58.00, $38.00 
3,M- ZEGNA UOMO 3.4 SPY MEN,50.00, $30.00 
3,M-SET ANIMALE (4pcs) 3.3oz SPY EDT+3.4oz B.W+3.4oz A.S. M,50.00, $25.00 
3,M-SET AQVA MARINE by BVLGARI (4pcs) 3.4zo SPY EDT+2.5oz S.G+2.5oz A.S.+BRAND NAME POUCH,65.00, $40.00 
3,M-SET AZZARO by AZZARO (2pcs) 3.4oz SPY EDT+5.0oz SPY DEODOANT M,60.00, $35.00 
3,M-SET BOUCHERON (3pcs) 3.3oz EDP SPY + 3.3oz AFTER SHAVE + 3.3oz SHOWER GEL MEN,70.00, $45.00 
3,M-SET BURBERRY BRIT RHYTHM (2pcs) 3.3oz SPY EDT+DEODORANT STICK MEN,63.00, $38.00 
3,M-SET BURBERRY BRIT SPLASH (3pcs) 3.4oz SPY EDT+2.6 MENS B.L+2.6+ S.G MEN,65.00, $40.00 
3,M-SET BURBERRY TOUCH (3pcs) 3.4oz SPY EDT 2*3.4oz SHOWER GEL MEN,63.00, $38.00 
3,M-SET BVLGARI AQVA AMARA (2pcs) 3.4oz SPY EDT+ 0.5oz SPY EDT MEN,63.00, $38.00 
3,M-SET BVLGARI MAN (2pcs) 3.4oz SPY EDT+ 0.5oz SPY EDT MEN,63.00, $38.00 
3,M-SET BVLGARI MAN EXTREME (2pcs) 3.4oz SPY EDT+ 0.5oz SPY EDT MEN,63.00, $38.00 
3,M-SET CAESARS (3pcs) 4.0oz SPY EDT + 3.3oz SHOWER GEL + 3.3oz AFTER SHAVE BALM MEN,43.00, $18.00 
3,M-SET CALVIN KLEIN CK BE (2pcs) 6.7oz SPY EDT+2.5oz DEODORANT,60.00, $35.00 
3,M-SET CALVIN KLEIN CK ONE (2pcs) 6.7oz SPY EDT + 8.5oz BODY LOTION MEN,60.00, $35.00 
3,M-SET CALVIN KLEIN CK ONE (4pcs) 6.7oz SPY EDT + 6.7oz BODY LOTION+ 3.4oz S.G.+ 0.5oz SPL EDT MEN,60.00, $35.00 
3,M-SET CALVIN KLEIN CK ONE SCHOCK (2pcs) 6.8oz SPY EDT + 3.4oz SHOWER GEL MEN,55.00, $30.00 
3,M-SET CALVIN KLEIN ENCOUNTER (2pcs) 3.4oz SPY EDT + 3.4oz SPY AFTER SHAVE MEN,70.00, $45.00 
3,M-SET CALVIN KLEIN ESCAPE (2pcs) 3.4oz SPY EDT + 6.7oz AFTER SHAVE BALM MEN (TRAVEL BOX),50.00, $25.00 
3,M-SET CALVIN KLEIN ETERNITY AQUA (2pcs) 3.4oz SPY EDT +3.4oz A.S,60.00, $35.00 
3,M-SET CALVIN KLEIN EUPHORIA (3pcs) 3.4oz SPY EDT + 2.6oz DEODORANT STICK + 3.4oz AFTER SHAVE BALM MEN,60.00, $35.00 
3,M-SET CALVIN KLEIN OBSESSION (3pcs) 4.0oz SPY EDT+ 2.6oz DEODORANT STICK + 4.0oz ASB M,65.00, $40.00 
3,M-SET CALVIN KLEIN OBSESSION DARK (3pcs) 4.2oz SPY EDT 2.6oz DEODORANT+3.4oz A.S MEN,60.00, $35.00 
3,M-SET CARLO CORINTO 315 (4pcs) 3.4oz SPY EDT + 4.8oz A.S. + 4.8oz S.G.+ 5.2oz PERFUMED BAR SOAP MEN,55.00, $30.00 
3,M-SET CARLO CORINTO ROUGE (4pcs) 3.4oz SPY EDT+4.8oz A.S.+ 4.8oz S.G.+ 5.2oz PERFUMED BAR SOAP MEN,55.00, $30.00 
3,"M-SET CAROLINA HERRERA ""CH SPORT"" (2pcs) 3.4oz SPY EDT + 3.4oz AFTER SHAVE M",60.00, $35.00 
3,M-SET CAROLINA HERRERA 212 VIP (2pcs) 3.4oz SPY EDT+3.4oz S.G M,75.00, $50.00 
3,M-SET CAROLINA HERRERA HERRERA (2pcs) 3.4oz SPY EDT + 3.4oz AFTER SHAVE BALM MEN,70.00, $45.00 
3,M-SET CARTIER DECLARATION DUN SOIR 3.4oz SPY M,65.00, $40.00 
3,M-SET CHRISTIAN AUDIGIER (3pcs) 3.4oz SPY EDT + 3.0oz SHOWER GEL + 2.75oz DEODORANT STICK MEN,45.00, $20.00 
3,M-SET CUBA (3pcs) 3.3oz SPY EDT + 3.3oz AFTER SHAVE SPY + 6.6oz DEODORANT SPY MEN,35.00, $10.00 
3,M-SET CUBA (4pcs) 4 PERFUME BOTTLE 1.17ozSPY M,33.00, $8.00 
3,M-SET CUBA GOLD (4pcs) 3.3oz SPY EDT + 1.17oz SPY EDT + 3.3oz AFTER S. SPY+6.8oz S.G SPY M,35.00, $10.00 
3,M-SET CUBA GOLD 3.4oz SPY EDT + 6.6oz DEODORANT SPY MEN (SILVER BULLET),33.00, $8.00 
3,M-SET CUBA GOLD BUCKET (5pcs) 3.3oz SPY EDT + 1.17oz SPY EDT + 3.3oz AFTER S. SPY+6.6oz DEO SPY MEN,40.00, $15.00 
3,M-SET DANIEL BANKS (3pcs) 3.4oz SPY EDT + 0.34oz SPLASH EDT + 5.9oz SHOWER GEL MEN,31.00, $6.00 
3,M-SET DAVIDOFF THE GAME 3.4oz SPY EDT + 2.5oz BODY WASH M,55.00, $30.00 
3,M-SET DAVIDOFF CHAMPION ENERGY (2pcs) 3.0oz SPY EDT + SPORTS FLASK MEN,55.00, $30.00 
3,M-SET DAVIDOFF SILVER SHADOWN (3pcs) 3.4oz SPY EDT + 1.7oz SHOWER GEL + 1.7oz AFTER SHAVE BALM MEN,55.00, $30.00 
3,M-SET DOLCE & GABBANA INTENSO (3pcs) 4.2oz SPY EDT + 2.5oz DEODORANT + 1.6oz SHOWER GEL MEN,75.00, $50.00 
3,M-SET DOLCE & GABBANA THE ONE (3pcs) 3.4oz SPY EDT + 2.5oz AFTER SHAVE BALM + 1.6oz SHOWER GEL MEN,75.00, $50.00 
3,M-SET DONALD TRUMP SUCCESS (3pcs) 3.4oz SPY EDT + 2.5oz DOEODORANT STICK + 3.0oz SHOWER GEL MEN,60.00, $35.00 
3,M-SET DRAKKAR by GUY LAROCHE (3pcs) 3.4oz SPY EDT + 2.6oz DEO STICK+3.4oz AFTER SHAVE MEN,60.00, $35.00 
3,M-SET DUNHILL DESIRE BLUE (2pcs) 3.4oz SPY EDT + 5.0oz AFTER SHAVE BALM MEN,65.00, $40.00 
3,M-SET DUNHILL FRESH (2pcs) 3.4oz SPY EDT + 5.0oz AFTER SHAVE BALM MEN,60.00, $35.00 
3,M-SET ED HARDY BORN WILD (5pcs) 3.4oz EDT+0.25oz SPY EDT+3.0oz S.G.+ 2.75oz DEO + KEY CHAIN MEN,55.00, $30.00 
3,M-SET ED HARDY LOVE & LUCK (5pcs) 3.4oz SPY EDT+0.25oz SPY EDT+2.75oz DEO+3.0oz S.G.+I.D HOLDER MEN,50.00, $25.00 
3,M-SET ED HARDY LOVE IS (3pcs) 3.4oz SPY EDT + 4.2oz AFTER SHAVE + 4.2oz BODY WASH M,55.00, $30.00 
3,M-SET ELIZABETH TAYLOR PASSION (2pcs) 4.0oz SPY EDC + 4.0oz AFTER SHAVE MEN,40.00, $15.00 
3,M-SET EVERYONE by LAMIS (3pcs) 3.4oz SPY EDT + 2.5oz DEODORANT SPY + PEN AND PENCIL MEN,31.00, $6.00 
3,M-SET FCUK (2pcs) 3.4oz SPY EDT + 6.7oz BODY SHAMPOO M,45.00, $20.00 
3,M-SET GIVENCHY BLUE LABEL (3pcs) 3.3oz SPY EDT+ 2.5oz SHOWER GEL+2.5oz AFTER SHAVE M,65.00, $40.00 
3,M-SET GIVENCHY GENTLEMAN (2pcs) 3.4oz SPY EDT+2.5oz SHAMPOO,65.00, $40.00 
3,M-SET GIVENCHY GENTLEMEN ONLY (3pcs) 3.3oz SPY EDT + 2.5oz SHOWER GEL + 2.5oz AFTER SHAVE M,70.00, $45.00 
3,M-SET GIVENCHY PLAY (3pcs) 3.3oz SPY EDT+3.4oz S.G+3.4oz A.S.,65.00, $40.00 
3,M-SET GIVENCHY PLAY SPORT (2pcs) 3.3oz SPY EDT + 6.7oz SHOWER GEL MEN,65.00, $40.00 
3,M-SET GREY FLANNEL by GEOFFREY BEENE (2pcs) 4.0oz SPY EDT + 4.0oz AFTER SHAVE SPLASH MEN,43.00, $18.00 
3,M-SET GUCCI by GUCCI (2pcs) 3.0oz SPY EDT 3.0oz A.S M,73.00, $48.00 
3,M-SET GUCCI GUILTY (3pcs) 3.0oz SPY EDT+ 2.5oz AFTER SHAVE+ 1.6oz SHOWER GEL M,75.00, $50.00 
3,M-SET GUERLAIN HABIT ROUGE (3pcs) 3.3oz SPY EDT + 2.5oz SHOWER GEL + 1.7oz DEODORANT SPY MEN,70.00, $45.00 
3,M-SET GUERLAIN POR HOMME (3pcs) 2.7oz SPY EDT + 2.5oz SHOWER GEL + 1.7oz DEODORANT SPY MEN,70.00, $45.00 
3,M-SET HALSTON Z-14 (2pcs) 4.2oz SPY COLOGNE + 4.2oz AFTER SHAVE SPLASH MEN,43.00, $18.00 
3,M-SET HIS 777 (3pcs) 3.3oz SPY EDT + 0.33oz SPY EDT + 2.5oz DEODORANT STICK MEN,40.00, $15.00 
3,M-SET HOMBRE CALIENTE (4pcs) 4.2oz SPY EDT+1.3oz SPY + 3.0oz SG + 3.4oz AF M,37.00, $12.00 
3,M-SET HUGO BOSS #6 (3pcs) 3.3oz SPY EDT + 1.6oz SHOWER GEL + 2.5oz AFTER SHAVE BALM MEN,63.00, $38.00 
3,M-SET HUGO BOSS (3pcs) 4.2oz SPY EDT+2.5oz A.S.+1.6oz S.G MEN,63.00, $38.00 
3,M-SET HUGO BOSS BALDESSARINI (3pcs) 2.5oz SPY + 1.7oz SHOWER GEL + 1.4oz DEODORANT STICK MEN,60.00, $35.00 
3,M-SET HUGO BOSS JUST DIFFERENT (3pcs) 4.2oz SPY EDT + 1.7oz S.G+ 2.5oz DEODORANT STICK M,63.00, $38.00 
3,M-SET HUGO BOSS RED (3pcs) 4.2oz SPY EDT 1.6oz SHOWER GEL-2.4oz DEO STICK MEN,60.00, $35.00 
3,M-SET ISSEY MIYAKE SPORT (3pcs) 3.3oz SPY EDT + 2.5oz SHOWER GEL + TRAVEL BAG MEN,73.00, $48.00 
3,M-SET JAY Z GOLD (3pcs)3.4oz SPY EDT+3.0oz A.F+3.0oz S.G MEN,60.00, $35.00 
3,"M-SET JENNI RIVERA ""EL SPORT"" (3pcs) 3.4oz SPY EDT + 3.4oz S.G+3.4oz A.S M",65.00, $40.00 
3,"M-SET JENNI RIVERA ""EL"" (3pcs) 3.4oz SPY EDT + 3.4oz S.G+3.4oz A.S M",65.00, $40.00 
3,M-SET JOHN VARVATOS ARTISAN (2pcs) 4.2oz SPY EDT+0.57oz SPY EDT M,65.00, $40.00 
3,M-SET JOOP! (2pcs) 3.4oz SPY EDT+ 2.5oz AFTER SHAVE SPLASH M,60.00, $35.00 
3,M-SET KENNETH COLE REACTION (3PCS) 3.4oz SPY EDT + 3.4oz AFTER SHAVE BALM +2.5oz DEODORANT,60.00, $35.00 
3,M-SET KENNETH COLE VINTAGE BLACK (3pcs) 3.4oz SPY EDT+3.4oz AFTER SHAVE+2.7oz DEODORANT STICK MEN,60.00, $35.00 
3,M-SET LACOSTE CHALLENGE REFRESH (2pcs) 3.0oz SPY EDT + 5.0oz SHOWER GEL MEN,60.00, $35.00 
3,M-SET LACOSTE L.12.12 EAU DE BLANC (2pcs) 3.3oz SPY EDT + 5.0oz SHOWER GEL MEN,60.00, $35.00 
3,M-SET LACOSTE L.12.12 EAU DE JAUNE (2pcs) 3.3oz SPY EDT + 5.0oz SHOWER GEL MEN,60.00, $35.00 
3,M-SET LACOSTE L.12.12 EAU DE NOIR (2pcs) 3.3oz SPY EDT + 5.0oz SHOWER GEL MEN,60.00, $35.00 
3,M-SET LACOSTE L.12.12 JAUNE YELLOW (2pcs) 3.3oz SPY EDT + 5.0oz SHOWER GEL MEN,60.00, $35.00 
3,M-SET LAGERFELD CLASSIC 4.2oz SPY EDT,50.00, $25.00 
3,M-SET LAKERS LOS ANGELES by NBA (3pcs) 3.4oz SPY EDT+5.1oz S.G.+ KEY CHAIN MENS,40.00, $15.00 
3,M-SET LANVIN LHOMME (3pcs) 3.3oz SPY EDT + 3.3oz AFTER SHAVE BALM + 3.3oz SHOWER GEL MEN,53.00, $28.00 
3,M-SET LIZ CLAIBORNE CURVE (4pcs) 4.2oz SPY EDC + 0.5oz SPY EDC+ 2.5oz A.F+2.5oz S.G M,50.00, $25.00 
3,M-SET LIZ CLAIBORNE CURVE 4.2oz M (DUFFLE BAG),50.00, $25.00 
3,M-SET LIZ CLAIBORNE CURVE APPEAL 2.5oz SPY EDT+ 3.4oz A.S M (2pcs),40.00, $15.00 
3,M-SET LIZ CLAIBORNE CURVE CRUSH (4pcs) 4.2oz SPY EDC+0.5oz SPY EDC+2.5oz BODY LOTION+2.5oz S.G. M,50.00, $25.00 
3,M-SET LOLITA LEMPICKA (2pcs) 3.4oz SPY EDT+2.5oz S.G M,55.00, $30.00 
3,M-SET MARC ECKO ECKO GREEN (2pcs) 3.4oz SPY EDT + 2.5oz DEO STICK M,50.00, $25.00 
3,M-SET MICHAEL GERMAN SEXUAL 2.5oz SPY EDT M,65.00, $40.00 
3,M-SET MONT BLANC EMBLEM (3pcs) 3.4oz SPY EDT+3.4oz A.S.+3.4oz S.G M,60.00, $35.00 
3,M-SET MONT BLANC EMBLEM INTENSE (3pcs) 3.4oz SPY EDT+3.4oz A.S.+3.4oz S.G M,60.00, $35.00 
3,M-SET MONT BLANC LEGEND (3pcs) 3.3oz SPY EDT+3.3oz A.S.+3.4oz S.G,60.00, $35.00 
3,M-SET MONT BLANC LEGEND INTENSE (3pcs) 3.4oz SPY EDT+3.4oz A.S.+3.4oz S.G M,60.00, $35.00 
3,M-SET MONT BLANC PRESENCE (3pcs) 2.5oz SPY EDT + 3.3oz AFTER SHAVE BALM 3.3oz SHOWER GEL MEN,63.00, $38.00 
3,M-SET NARCISO RODRIGUEZ (2pcs) 3.4oz SPY EDT+1.6oz A.S M,80.00, $55.00 
3,"M-SET PACO RABANNE (2pcs) 3.4oz SPY EDT + 3.4oz SHOWER GEL MEN ""METAL BOX""",60.00, $35.00 
3,M-SET PACO RABANNE 1 MILLON (2pcs) 3.4oz SPY EDT+5.1oz DEO. (LUXURY METAL BOX),83.00, $58.00 
3,M-SET PACO RABANNE INVICTUS (2pcs) 3.4oz SPY EDT + 5.1oz DEO. (LUXURY METAL BOX),83.00, $58.00 
3,M-SET PACO RABANNE ULTRAVIOLET (2pcs) 3.4oz SPY EDT + 2.7oz DEODORANT STICK MEN,63.00, $38.00 
3,M-SET PACO RABANNE XS (2pcs) 3.3oz SPY EDT+5.1oz DEO. (LUXURY METAL BOX),60.00, $35.00 
3,M-SET PARIS HILTON (4pcs) 3.4oz SPY EDT .25oz SPY EDT + 3.0oz SHOWER GEL+ 2.75oz DEODORANT STICK MEN,50.00, $25.00 
3,M-SET PAUL SEBASTIAN (2pcs) 4.0oz SPY EDT + 4.0oz AFTER SHAVE MEN,45.00, $20.00 
3,M-SET PERRY ELLIS 18 (4pcs) 3.4oz SPY EDT+3.0oz A.S+3.0oz S.G+.25oz EDT MEN,50.00, $25.00 
3,M-SET PERRY ELLIS 360* (4pcs) 3.4oz SPY EDT + 0.25oz SPY EDT + 3.0oz S.G+ 3.0oz A.S MEN,48.00, $23.00 
3,M-SET PERRY ELLIS 360* BLACK(4pcs)3.4oz SPY EDT+0.25oz SPY EDT+2.75oz DEODORANT STICK+3.0oz A.S MEN,48.00, $23.00 
3,M-SET PERRY ELLIS 360* GREEN (4pcs) 3.4oz SPY EDT + 0.25oz SPY EDT + 3.0oz S.G+ 3.0oz A.S MEN,50.00, $25.00 
3,M-SET PERRY ELLIS 360* RED (4pcs) 3.4oz SPY EDT + 0.25oz SPY EDT + 3.0oz S.G+ 3.0oz A.S MEN,48.00, $23.00 
3,M-SET PERRY ELLIS 360* WHITE(4pcs)3.4oz SPY EDT+0.25oz SPY EDT+2.75oz DEODORANT STICK+3.0oz A.S MEN,48.00, $23.00 
3,M-SET PERRY ELLIS AQUA (4pcs) 3.4oz SPY EDT + 2.75oz DEODORANT STICK+ 3.0oz S.G + 3.0oz A.S MEN,53.00, $28.00 
3,M-SET PERRY ELLIS HIM (4pcs) 3.4oz SPY EDT+ 0.25oz SPY EDT+ 2.75oz DEODORANT STICK+ 3.0oz S.G MEN,48.00, $23.00 ,,
3,M-SET PERRY ELLIS M (4pcs) 3.4oz SPY EDT+ 0.25oz SPY EDT+ 2.75oz DEODORANT STICK+ 3.0oz A.S MEN,50.00, $25.00 ,,
3,M-SET PERRY ELLIS MAN (4pcs) 3.4oz SPY EDT+ 0.25oz SPY EDT+ 2.75oz DEODORANT STICK+ 3.0oz A.S MEN,48.00, $23.00 ,,
3,M-SET PERRY ELLIS NEW!!! (2pcs) 3.4oz SPY EDT + 3.4oz AFTER SHAVE SPLASH MEN,50.00, $25.00 ,,
3,M-SET PERRY ELLIS NIGHT (3pcs) 3.4oz SPY EDT+ 2.75oz DEODORANT STICK+ 3.0oz A.S MEN,50.00, $25.00 ,,
3,M-SET PERRY ELLIS PLATINUM LABEL (3pcs) 3.4oz SPY EDT+ 2.75oz DEODORANT STICK+ 3.0oz A.S MEN,48.00, $23.00 ,,
3,M-SET PERRY ELLIS RESERVE(4pcs)3.4oz SPY EDT+0.25oz SPY EDT+2.75oz DEODORANT STICK+3.0oz A.S MEN,48.00, $23.00 ,,
3,M-SET PIERRE CARDIN (3pcs) 2.8oz SPY EDT+3.4oz A.S.+1.0oz SPY EDT,45.00, $20.00 ,,
3,M-SET PITBULL (3pcs) 3.4oz SPY EDT +3.4S.G+3.4oz A.S M,55.00, $30.00 ,,
3,M-SET PRADA LUNA ROSA (2pcs) 3.4oz SPY EDT +3.4oz A.S. M,80.00, $55.00 ,,
3,M-SET QUORUM by ANTONY PUIG (2pcs) 3.3oz SPY EDT + 3.3oz AFTER SHAVE SPLASH M,40.00, $15.00 ,,
3,M-SET QUORUM SILVER by ANTONY PUIG (2pcs) 3.4oz SPY EDT + 3.3oz AFTER SHAVE SPLASH M,40.00, $15.00 ,,LIST
3,M-SET ROCA WEAR EVOLUTION (2pcs) 3.4oz SPY EDT + BRAND NAME WATCH MEN,50.00, $25.00 ,,
3,"M-SET Royal Copenhagen 5pcs Set (3.3oz spy cologne, 3.3oz Hair & Body Wash, 2.5oz Deo Stick, Soap, Poker Playing Cards)",43.00, $18.00 ,,
3,M-SET SALVADORE FERRAGAMO F BLACK 3.3oz SPY EDT +3.4oz SHOWER GEL+ 3.4oz AFTER SHAVE M,60.00, $35.00 ,,
3,M-SET SALVADORE FERRAGAMO HOMME (3pcs) 3.4oz SPY EDT+2.5oz A.S.+2.5oz S.G,53.00, $28.00 ,,
3,M-SET SEAN JOHNN I AM KING (3pcs) 3.4oz SPY EDT+ 3.4oz S.G.+ 3.4oz A.F MEN.,70.00, $45.00 ,,
3,M-SET SEAN JOHNN UNFORGIVABLE (3pcs) 4.2oz SPY EDT+ 3.4oz S.G.+ 3.4oz A.F MEN.,70.00, $45.00 ,,
3,M-SET SWISS ARMY by ALTITUDE (2pcs) 3.4oz SPY EDT+2.5oz DEO,50.00, $25.00 ,,
3,M-SET SWISS ARMY UNLIMITED (3pcs) 2.5oz SPY EDT+2.5oz DEO+BRAND NAME POUCH,50.00, $25.00 ,,
3,M-SET THERRY MUGLER ANGEL (2pcs) 3.4oz SPY EDT+2.5OZ DEODORANT STICK MEN,70.00, $45.00 ,,
3,M-SET THIERRY MUGLER COLOGNE (3pcs) 3.4oz SPY EDT + 4.4oz SHOWER GEL + TRAVEL BAG MEN,70.00, $45.00 ,,
3,M-SET TOMMY FREEDOM (2pcs) 3.4oz SPY EDT + 5.0oz SHOWER GEL MEN,53.00, $28.00 ,,
3,M-SET USHER (3pcs) 3.4oz SPY EDT + 3.4oz AFTER SHAVE SOOTER + 2.6oz DEODORANT STICK MEN,53.00, $28.00 ,,
3,M-SET VERSACE EROS (2pcs) 3.4oz SPY EDT+3.4oz S.G M,70.00, $45.00 ,,
3,M-SET VERSACE EROS (4pcs) 3.4oz SPY EDT+1.7oz A.S+1.7oz S.G.+BRAND NAME WALLLET MEN,73.00, $48.00 ,,
3,M-SET VERSACE POUR HOME (3pcs) 3.4pz SPY EDT 3.4oz S.G.+VERSACE DOOP BAG,70.00, $45.00 ,,
3,"M-SET VINCE CAMUTO HOMME (3pcs) 3.4oz SPY EDT+0.5oz EDT+2.5oz DEODORANT STICK ""BLUE BOTTLE""",60.00, $35.00 ,,
3,"M-SET VINCE CAMUTO MAN (3pcs) 3.4oz SPY EDT+0.5oz EDT+2.5oz DEODORANT STICK ""BLACK BOTTLE""",60.00, $35.00 ,,
3,M-SET YSL KOUROS (2pcs) 3.3oz SPY EDT + 3.3oz SHOWER GEL MEN,70.00, $45.00 ,,
